PASCO Personal Assistance Services of Colorado,719-960-4995,https://pascohh.com/,6385 Corporate Dr Ste 303 80919,"Helps those with special needs/mental health needs by offering: training families for becoming caregivers/CNAs, in home support services, respite care, care plans that are client directed, veterans care/their spouses, private duty nursing, therapy for children and family, "
"PeaceWorks, Inc.",303-838-8181,https://peaceworksinc.co/,"Park & Jefferson Counties, CO","24/7 crisis line, emergency shelter, legal support, advocacy, emergency pet shelter, mobile advocacy, therapy, support groups, & education"
Peak Education,719-389-1249,peakedu.org,117 S Wahsatch Ave 80903,"Initially conceived as a scholarship-based incentive program, over more than two decades Peak Education has evolved into a mentoring and college access organization that provides long-term engagement with students and families focused on four strategies for success: developing college and career readiness, building students’ capacity for leadership, fostering full family engagement in their students’ journeys, and creating broad-based community connections."
Peak Parent Center-Family Connections- Catholic Charities,719-531-9400,peakparent.org/,"917 E Moreno Ave. Ste 140, C/S","Helping families with children with disabilities, resources, advcates,trainings, including Spanish resource library"
Pikes Peak Library District-Adult Education,719-531-6333,https://ppld.org/adult-education,,Free GED courses for library patrons.
Pillar Institute for Lifelong Learning,719-633-4991,https://www.pillarinstitute.org/,"6385 Corporate Dr, Ste 200, Colorado Springs CO",Free classes for lifelong learning
Play Date Behavioral Interventions,719-465-3989 respite: 719-439-4155,myplaydate.org,6050 Erin Park Dr C/S CO 80918    info@myplaydate.org,"Play­Date Behavioral Interventions is a nonprofit organization providing a full spec­trum of applied behavioral interventions to chil­dren with disabilities, including Applied Behavior Analysis (ABA) Therapy, Community Connector, Pediatric Personal Care (PPC), Educational Placement and Respite Care."
project Diakonia,888-757-9675,https://projectdiakonia.org/,3595 E Fountain Blvd 80910,"Job retention, adult basic education, employability services, vocational rehab, on-the-job-training, vocational training, case menagement, supportive services, meets minimum employment requirements for DHS to reinstate food stamps/etc"
Protect the Game,970-231-3672,https://www.protectthegame.org/,info@protectthegame.org,Giving vets a job by training them to umpire youth sports and creating more certified employees for sporting event authorities
Purple Star Schools,303-866-6600,competitive grants@cde.state.co.us,"Division of School Finance, Office of Grants Program Administration, 1525 Sherman St, Denver CO 80203",
Queer Asterisk,720-507-6161,https://queerasterisk.com/,"1575 Franklin St, Denver CO, 80218","Counseling LGBTQIAKPN Educational training for community providers to help the comm be welcoming; art therapy, workshops, queer convo groups"
Rape Abuse and Incest National Network,800-656-HOPE,,"More than 1,100 trained volunteers are on duty and available to help victims at RAINN-affiliated crisis centers across the country",
Response,970-925-7233,https://responsehelps.org/,"Aspen, CO","24/7 crisis line, emergency shelter, court accompaniment, advocacy, sexual harassment assistance, medical accompaniment, immigration assistance, & education"
Restoring Connections,303-383-1610,cfsaw.org,"1385 S Colorado Blvd, Bldg A, Ste 300, Denver, CO 80222","Restoring Connections, formerly called the Center for Spirituality at Work, provides mentoring for incarcerated women through Making Choices. Upon release, graduates of their mentoring program participate in advocacy efforts and help to train new volunteers."
Rise Above,,https://www.riseaboveco.org/,,"Stubstance misuse prevention organization that empowers youth to make healthy connections, decisions and change. Educational resources, community and friends"
Rise Up School,719-447-9333,rup.org,"5045 List Dr, 80919; 2121 E LaSalle St, Ste 100, 80909","Individuals with Developmental disability host home providers, child family caregivers (CNA???), Children's residential program for ages 5-18 who need help; school K-12; Adult Day program; adult residential program; adult family caregiver (CNA???); adult supported employment"
Rocky Mountain PACE Program of All-inclusive Care for the Elderly,855-207-0702  719-314-2327,https://rmpace.org/,"8595 Explorer Dr C/S 80920   2502 E Pikes Peak Ave Ste #100 C/S, CO 80909","Coordinated and all-inclusive health care for the elderly: Social, adult day/health center, recreational activities, educational classes; Support: transportation, CM to coordinate services, home health care, personal care and laundry services, respite care; Wellness: nutritious meals and snacks, homemaker services, recreation therapy, counseling, home health care, medication, physical tx; Medical: physical and occupational therapy, emergency, hospital and nursing home care when needed, all necessary Rx with no co-pay, medical specialists, med clinic with Dr and nurses, skilled home health care"
Safe Families for Children,773-355-5577   Fax: 773-355-5564,https://coloradosprings.safe-families.org/   info@safefamilies.net ,jstephenson@safefamilies.net ,"Prevent child abuse and neglect, strengthen and stabilize the family, reduce the number fo children going into foster care, partnering with churches where families open their homes to families in crisis"
Safe Shelter of St. Vrain Valley,303-772-4422,https://safeshelterofstvrain.org/,"Longmont, CO","24/7 crisis line, emergency shelter, individual & group counseling, case management, legal advocacy, & education"
SafeHouse Denver,303-318-9989,https://safehouse-denver.org/,"Denver, CO","24/7 crisis line, non-residential counseling & advocacy, emergency shelter, short-term extended stay housing, advocacy, & education"
Safehouse Progressive Alliance for Nonviolence,303-444-2424,https://www.safehousealliance.org/,"Boulder, CO","24/7 crisis line, emergency shelter, counseling, legal advocacy, housing program, & education"
Salvation Army (for families only)/Family Hope Center,719-578-9190 719-635-1287,coloradosprings.salvationarmy.org pstock.tsa@gmail.com https://www.salvationarmyusa.org/usn/home/#whatwedo,"709 S Sierra Madre St, Colorado Springs, CO, 80903","Families shelter (children under 18), 90 day facility, get housing, case workers ONLY IF IN PROGRAM; Fountain has more financial resources that C/S branch; holiday gifts, rent, utility, food, rehab, summer camps, disaster relief, lgbtqiakpn support, domestic abuse, elderly, job training, veteran, life skills, human trafficking"
San Miguel Resource Center,844-816-3915,https://smrcco.org/,"Telluride, Norwood, & Naturita, CO","24/7 help line, education, & legal advocacy"
School Connect,719-428-5988,https://schoolconnectcos.com/,"310 S 14th St, C/S, CO 80904",School Supplies drive
Serenity Recovery Connection,719-465-2295,srchope.org,985 W Fillmore St 80907,"Recovery solutions for addiction, bus passes A LOT, good recommendation from Mr. Justin, peer cert classes, has scholarships, resource database"
"SET Family Medical Clinics (Service, Empowerment, Transformation)",303-458-5851,https://www.mountain.commonspirit.org/location/set-family-medical-clinics,"2864 S Circle Dr Ste 450, C/S, CO 80906","Adult physicals, behavioral health, daycare, school and sports physicals, dental hygiene, behavioral health. Bridging health care gaps for under served"
SET Homeless Clinic,719-776-8850,https://www.findhelp.org/centura-health--colorado-springs-co--set-homeless-clinic/5868439713480704?postal=80901,14 W Bijou 80903,"Homeless medical care, very low income. Teeth, cuts, infected fingers, asthma, over the counter pain medication, and antacids, medical care, hygiene items, socks, health education"
Sex Offender Solutions and Education Network,800-773-4319,https://sosen.org/,"2211 CR 400 Tobias, NE 68453","SOSEN Educate the public, the news media, law enforcement and legislators with the true facts about child sexual abuse   DEFUNCT???"
SLV Immigrant Resource Center,719-587-3225,https://www.slvirc.org/,"Alamosa, CO","Immigration legal assistance, legal residency support, housing assistance, counseling, & education"
Snap2Jobs (dba PrismXL),888-757-9675,https://snap2jobs.org/,3595 E Fountain Blvd 80910,"Job retention, adult basic education, employability services, vocational rehab, on-the-job-training, vocational training, case menagement, supportive services, meets minimum employment requirements for DHS to reinstate food stamps/etc"
SOAR Training,,https://www.easterseals.com/co/shared-components/spotlights/featured-resources/program-resources/disability-benefits-services/colorado-soar-training.html,,"Training an individual on how to properly sign up for SSI/SSDI, usually for case managers whom are helping unhoused individuals"
Social Work Education Center,,https://www.socialworkdegree.net/,,"Resource Database, social work information on education and certification requirements"
Southern Peaks Regional Treatment Center,719-276-7500,southernpeaksrtc.org/,81212,"specialized behavioral health programs for both male and female adolescents, ages 10 to 18 (over 18 considered on a case by case basis), who are experiencing emotional, behavioral, psychological, educational, or social problems."
Special Kids Special Families  SKSF,719-447-8983,sksfcolorado.org           sksf@sksfcolorado.org,1915 Aerotech Dr.,"Foster care and adoption, wraparound services, respite care and daycare for children with disabilities and special needs. Joey's place adult center-activity center for adults with special needs and disabilities; residential host homes: caring and nurturing homes for adults with diabilities, behavioral health, transportation, mentorship, special olympics, home care, workforce development, education and training, veteran support services"
Staging Her,,stagingher.org,,Helping women from developing countries to rise above barriers by learning the power of circus art to tell their stories through training and performance in the US
Street Petz-Colorado Springs Chapter,719-629-7389,https://www.facebook.com/StreetPetsColoradoSpringsChapter/,Monument Valley Park streetpetz.org,"violence prevention, mental health support, leadership program, school time program, food,            workforce development program"
Successful4Life Tutoring Services,303-330-9464,https://www.success4lifetutoring.com/    Chad.Ducklow@Success4LifeGED.com,"Success4Life Tutoring, Inc. 1232 Bergen Pkwy, Ste. #205, Evergreen, CO 80439",provides daily tutoring for Galileo middle school students and others referred to the center
Supervised Exchange and Parenting Time,719-447-9898,https://www.casappr.org/programs/sept/,"418 S Weber St, Colorado Springs, CO 80903 8","CASA (Court Appointed Special Advocates) of the Pikes Peak Region is a volunteer-based nonprofit organization serving El Paso County and Teller County that trains and supervises volunteers to represent the best interests of our most vulnerable citizens – victims of child abuse, neglect, and severe domestic conflict. CASA volunteers are appointed by judges to be a voice for these children in court and in the community. The desired result is that children are placed into safe, loving homes where they can thrive."
Tax deduction for Emotional/Service Support Animal,,https://www.pawlicy.com/blog/tax-deductions-for-pet-owners/,,Ways an animal can qualify for tax deduction
Temporary Assistance for Needy Families,303-866-5700,https://cdhs.colorado.gov/colorado-works   ,"1575 Sherman St, Denver, CO 80203","Cash payment, schooling, training and jobs, elderly, disabilities, children, parents"
TerpsEXCEED,,https://www.ihehub-umd.org/terps-exceed,terpsexceed@umd.edu,"University of Maryland: hub for inclusive higher education-helping those with intellectual disabilities to participate in college experience for two years, culminating in a certificate"
TESSA,719-633-3819 Crisis Line 24/7: 719-633-3819,tessacs.org,"435 Gold Pass Heights 80906, 24-hour crisis line, safehouse, victim advocacy (719-633-1462), and OHS liaisons (719-444-8119)","Domestic Violence Survivors Assistance; legal assistance, restraining orders"
TGTHR,303-447-1206,https://tgthr.org/,1440 Pine St Ste B Boulder CO 80302,"Youth Homelessness not-for-profit, shelter, long-term housing, basic needs, employment, counseling, education"
Thrive Colorado,720-764-2226,https://thrivecolorado.org/?utm_source=google&utm_medium=cpc&utm_campaign=CID-23244_Snap-2-Jobs_October-2024_Search-Google_Google-Ads_Text-Ads&gad_source=1&gclid=Cj0KCQjwveK4BhD4ARIsAKy6pMKNMWImd5Ua6FrNU3MT2YYHiHMgTwCMxtWNiEJIK-zIAaFN1LQ4pJcaAnPyEALw_wcB&gclsrc=aw.ds,"info@thrivecolorado.org   3435 S Inca St Ste C, Englewood CO 80110","Employment agency with training, licensing and certifications and classes for its clients"
Thrive Network,719-301-6212,thethrivenetworks.org,"1520 Verde Dr, Colorado Springs, CO 80910","Engaging, Educating and Empowering Individuals to Unlock Their Potential, Build Resilient Businesses and Strengthen Under Resourced Communities Through Entrepreneurship. "
Thrivent,800-847-4836,https://www.thrivent.com/generosity/money-canvas/home?utm_source=sem&utm_medium=google&utm_campaign=Money_Canvas_General_NB_voro&utm_adgroup=General&utm_term=financial+education+courses&gclid=CjwKCAjwreW2BhBhEiwAavLwfNxfWL67pLwyJTKTFrin7yB26uFrFpnzmcB7dUZ6OkApJo-24MT4SxoC2_YQAvD_BwE&gclsrc=aw.ds,MN/WI,Financial Classes
Too Good To Go,,https://www.toogoodtogo.com/en-us,,"A company/app that helps companies/restaurants prevent food waste by offering the food at reduced rates toward the end of business day. Set up the time on your schedule, reduce food and drink waste."
Tri-Lakes Cares,719-481-4864,http://tri-lakescares.org/,"235 N Jefferson St, Monument","Post-Secondary Education scholarship program and financial assistance for GED training and testing, rent, mortgage, utilities, car maintenance, food, bus passes, clothing, medical supplies/bills, gas cards"
"Tu Casa, Inc.",719-589-2465,https://www.slvtucasa.net/,"Alamosa, CO","24/7 crisis line, filing of legal documents, assistance with accessing social services, emergency shelter, assistance with resource/financial applications, child advocacy, & prevention education"
Tutoring,,https://ppld.org/databases/helpnow,https://research.ppld.org/c.php?g=795779&p=6827699,Tutoring and test prep center for High School
Unemployment Resource Lists,,Financial: https://sites.google.com/state.co.us/employment-and-training-grants/home/quest-dwg,,Resource database for unemployment
United Providers,719-291-0296,https://upro1.com/,"6197 Lehman Dr. Ste 106, C/S, CO 80918","Employment, residential homemaker services, personal care services, mentorship services, respite care for adults, prevocational services, supported employment, supported housing for those with mental/physical/vocational needs not often covered by others. Individuals can apply on their own if needed."
United Way SEE: PIKES PEAK UNITED WAY,719-632-1543,https://www.ppunitedway.org/   https://www.unitedway.org/our-impact/focus,"518 N Nevada Ave, C/S, CO 80903","Call 211, and they will deliver a food box to your door within 24-48 hrs, financial classes, "
Universal Education Foundation,719-641-2017,https://www.universaleducationfoundation.com/,301 E Platte Ave 80903,"Since 1986, the Foundation has worked with children and their families to create a balance in the family unit. When balance does not exist, pain, anger, and fear are the result. Multiply this with all members of a family, the environment becomes explosive."
University of the People,(626) 264-8880,uopeople.edu,"595 E Colorado Blvd Suite 623, Pasadena, CA 91101","Free education for college up to a masters in business administration, information technology, education (M. Ed); Bachelors in business admin, health sciences, computer sciences; same as bachelors for associates degree."
VA Survivors' and Dependents' Education Fund,,https://www.va.gov/family-and-caregiver-benefits/education-and-careers/dependents-education-assistance/,,Check if you're eligible for educational funds for veterans dependants and survivors 
Veteran Readiness and Employment program,,https://www.va.gov/careers-employment/vocational-rehabilitation/programs/,,
Veteran's Service Officers,719-520-7750  719-309-4729,vet@elpasoco.com,"530 Communication Cir, C/S, CO 80905","A Veteran Service Officer (VSO) is a trained and accredited professional who helps veterans, their families, and survivors apply for and manage VA benefits. VSOs can also help with resources for education, employment, health care, and more"
VISPDAT Training,,https://doh.colorado.gov/coordinated-entry-system,,Training for VISPDAT
Volunteers of America Southwest Safehouse,970-259-5443,https://www.voacolorado.org/gethelp-southernco-southwestsafehouse,"Durango, CO","24/7 crisis line, emergency shelter, resources, counseling, children’s services, life skills training, employment services, & parenting education"
Warrant Forgiveness Day,719475-1235,https://www.cpr.org/event/second-chances-warrant-forgiveness/,coswarrantforgiveness@coloradodefenders.us,"Open to anyone with an eligible active warrant/warrant for probation violation in EPC and Teller County: Class 5 Felony, Class 6 felony, Class 4 drug felony, misdemeanor, traffic offense, CS Municipal Offense"
Welcome COS,314-750-9263,https://welcomecos.org/,amy.schulte@welcomecos.org,"English language learning, job education and training/upskilling, community resource navigation, citizenship test tutoring, student tutoring and school navigation, cultural mentorship, small group curriculum focused on cross-cultural transition and resettlement, health and benefits navigation beyond 90 days, life skills training, guidance on affordable housing, in-kind donations, learning and networking opportunities for other working in the refugee sector, church education with a focus on refugee care"
Westernaires,303-279-3767,http://www.westernaires.org/,"15200 W 6th Ave, Unit B Golden, CO, 80401","Westernaires is a mounted precision drill organization composed of Denver-area youngsters from 9 to 19 years of age. Founded in 1949, Westernaires has provided training in western riding, precision drills, and horse care for over 70 years. Some members also elect to receive training in specialty acts such as trick riding, roman riding, and dressage."
Women's Resource Agency,719-471-3170,https://www.linkedin.com/in/wraincorg?trk=public_profile_browsemap_mini-profile_title,"reception@wrainc.org [undefined:reception@wrainc.org]   750 Citadel Dr E, Ste 3128, 80909","Uncertain if still a company, worth a shot; education, employment, advocac, personal and professional needs"
Women's Sports Foundation,800-227-3988,http://womenssportsfoundation.org/,"247 W 30th St, Fl 5, Ny Ny",Grants and scholarships for female athletes and for educational curriculum; financial assistance with travel thraining and sports fees
Woodmen Valley Chapel,719-388-5000 290 E Woodmen Rd,719-388-4916 8292 Woodmen Valley VW   woodmenvalley.org,719-533-6800 1681 Wagon Bow Way Monument   719-534-5215 1605 S Corona Ave,"Hospital visits, meal train ministry, sexuality struggles, marriage, relationship advice or counseling faith based, parent counseling, miscarriage/stillbirth/infant loss counseling; "
YMCA,,https://ppymca.org/about,,Not for profit with physical fitness classes
Young Williams,,https://youngwilliams.com/#,,"Child support, housing assistance, SNAP, child care assis., TANF Student financial aid, LIHEAP, food, clothing, utilities, educational support"
Youth Connections of Colorado,,https://youthconnectionsco.org/,Chelsea Taylor-Youth Connections Director chelsea.taylor@raisethefuture.org 303-755-4756 ext 222,"Youth Connections strengthens the ability of educators and schools to provide a school culture and climate that meets the social, emotional, and academic needs of all students, including those who experience significant challenges. With a focus on social emotional development and career-connected learning, Youth Connections provides educators and schools with technical assistance, resources, and support to improve mental health, well-being, and resiliency for adolescents in communities across Colorado."
YWCA of Pueblo Family Crisis Shelter,719-545-8195,https://ywcapueblo.org/,"Pueblo, CO","24/7 crisis line, emergency shelter, counseling, legal advocacy, legal support, resources, & education"
Zach's Place,719-329-1717,https://sksfcolorado.org/programs/children-family-services/zachs-place/,"4795 Granby Cir, Colorado Springs, CO, 80919","Daycare/respite care for kids with special needs/disabilities, transportation, RN, summer programs, weekend care, before and after school care"