Familly Resource Network CO,719-227-7477,https://familyresourcenetworkco.com/clinical-services/supervised-parenting-time,"5360 N Academy Blvd Ste 130, Colorado Springs, CO 80918","Resource Database, family visitation, CFI/Meditation, therapy (individual, family, couples), home studies, Contractual adoptive support services, to include home studies, pre and post placement services, and trainings, family preservation, supervised parenting time, classes such as first aid cpr, parenting classes, parent child interactions, life skills"
Family Connections,(719) 520-1019,https://www.ccharitiescc.org/family-connections-at-helen-hunt-campus/,2503 Holiday Lane 80909,"Provides high-quality, family- and child-oriented services for little or no cost. Also offer community trainings on child abuse/neglect issues, parenting, child development and shaken baby syndrome prevention."
"Family Crisis Services, Inc.",719-275-2429,https://www.familycrisisonline.org/,"Canon City, CO","24/7 crisis line, advocacy, emergency shelter, legal information & support, counseling, education, & emergency room support"
Family Support Center FSC,(719) 644-7511,https://fscautism.com/,6160 Tutt Blvd #120,"treatment of children and families impacted by Autism Spectrum Disorders. We understand that autism impacts the entire family and have designed a treatment program that offers support, education, treatment and a place of refuge for families."
Family Voices,303-877-1747,https://www.familyvoicesco.org/,info@familyvoicesco.org,"Resource Database for family needs; resource navigation; education and training (medicaid 101, HCBS-home and community based service waivers, insurance appeals, medical home model of care, family engagement, funding, navigating systems of care); advocacy and policy; "
Federal Government Loan,,https://www.usa.gov/government-loan,,"List of links for federal loans for: students who need help paying for school; buying a home/home repairs, funding their business, needing support after a disaster, farmers and ranchers"
Federal guide to Financial Counseling,,https://www.cob.uscourts.gov/credit-counseling-debtor-education-courses, ,Debtor and credit counseling
Feeding Friends,"1st and 3rd Thursdays, 10:30 am-when food runs out",,Mitchell High School 1205 Potter Dr 80909,Mobile Food Pantry
Financial Readiness Program,719-526-4783,https://myarmybenefits.us.army.mil/Benefit-Library/Federal-Benefits/Financial-Readiness-Program-(FRP),,"The Army's Financial Readiness Program (FRP) is available at every installation. Army Community Service (ACS) FRP teaches Soldiers in both classroom training & individual counseling sessions, how to save and invest their money, how to establish savings goals, debt elimination strategies, and saving for emergencies. Through partnerships with non-profit corporations, many of these tools and resources are provided online for those geographically separated from an ACS office. Contact your local installation ACS center or Family Service Center for more information."
First Visitor,719-632-5700,https://www.peakvista.org/services/first-visitor,,"Classes for parents to prevent sudden infant death syndrome (SIDS), abusive head trauma (AHT), or shaken baby syndrome (SBS); home mental health visits for yough children, program A: 0-12 months; probram B: 12-24 months; program C: 24-36 months; program D: 3-5 years. "
Food Industry Training Class,,https://ppld.org/FIT,,Four-week training program to learn skills for work as a prep cook or line cook. ServSafe Food Handler certificate
Food to Power,719-470-2737,http://www.foodtopowerco.org/,"1090 S Institute St, CS, CO 80903","reduce food waste, increase food access, food education, food production, use foods from overgrown gardens, mulch from food waste, Hillside Hub"
Forget-Me-Not,719-922-7906,forgetmenotcc.com     info@forgetmenotcc.com,"1425 N Union Blvd C/S, CO 80909","for children with mental or physical disabilities: part/full-day therapy sessions that helps to increase verbal, non-verbal comm; improve social interactions and relationships; develop self-help skills such as potty training, eating, and dressing; reduce harmful behaviors such as aggression, self-injury, elopement, tantrums; improve cognition, learning and play skills"
Foster Care and Adoptive Community,,fosterparents.com,,"foster parent guidance classes and support community, social worker/mft ceu credits and you can get all 40 hours from our courses-20 under each category!!!!!"
Foster Parent College,800-777-6636 fax: 541-343-0177,fosterparentcollege.com,support@fosterparentcollege.com,Various classes and resource database for foster parents
Foundation for Successful living,719-227-3939; Denver: 720-921-1405,thefsl.org,"1879 Austin Bluffs Pkwy, 80918",Helps individuals with disabilities to find a vocation that they can flourish in and to become closer to independence and freedom
Fountain's North Pole,,unk...,,"gifts for students in Fountain-Fort Carson school district 8 prek-12th grade; student must attend AIM, Aragon, Conrad, ELC, Eagleside, FFCHS, FMS, Jordahl, Mesa, Welte/FFCOA"
Friends of Garden of the Gods,,https://friendsofgardenofthegods.org/,,"Promote, preserve and enhance the natural and cultural assets of the Park through advocacy, education and support"
FRSO Revolution Socialism Liberation,612-477-5807,frso.org,,Freedom Road Socialist Organization (FRSO) is a national organization of revolutionaries fighting for socialism in the United States. Our home is in the working class.
Gateway to Success,719-374-1650,,,Substance Abuse Treatment and MA/OT Psychiatric services/DUI education/Domestic violence treatment
Gateways Through the Rockies,719-390-2129,beckyboerjan@elpasoco.com,"EPC, Sherriffs office","Educational, therapeutic programming, re0entry support, employable work experiences through community based partnerships"
Gather Food Studios,719-308-2992,http://www.gatherfoodstudio.com/,"2011 W Colorado Ave, Colorado Springs, CO 80904","Food classes, may have ability to offer deal to us?"
Genesis Center of Hope,719-358-8132,https://www.gencenters.org/,"308 W Fillmore St ste 200, C/S, CO, 80907","A donation-based and volunteer-run non profit organization with a special partnership with Bed Bath and Beyond and Walmart. Our charitable store offers a variety of items, such as bedding, vacuums, fans, cleaning products, bathroom and kitchen supplies, school supplies, clothing, and more for individuals and families in need. There is no cost to participate in our program, but we do welcome monetary donations, of whatever shoppers can afford."
Good Neighbor Garage,720-941-5897,goodneighborgarage.com  care@ehands.org   info@goodneighborgarage.org,"16097 S Golden Rd, Golden, CO, 80401","GNG is a unique car donation program as it is one of few charities in Colorado, which allows you to claim the full-market value of your donated car. When you donate to GNG, you can maximize your tax deduction making it a win-win for all! If you have additional questions, or if you would like to find out more about donating your vehicle to Good Neighbor Garage, please contact us at (720) 941-5897 or email GNG at info@goodneighborgarage.org"
Goodwill Resources,,https://goodwillcolorado.org/services/,,"Resource database of what's offered by goodwill. Help with farmers/ranchers, developmental, aging challenges, independence in agriculture trade and commerce; job training and support, LEAP (low-income energy assistance program); information technology training A+ cert, network + cert and security + cert for comptia; career development services, youth education/career development, mentoring, soft skills, work opportunities for those with disabilities (custodial), child support/improved payments and child success (impacs 303-412-3150), educational and social integration for refugee youth (CLIMB 720-392-8242), work skills and family stabilization (colorado works/tanf), soft and practical skills training (self-esteem, self-motivation, personal responsibility and reliability, cultural diversity and acceptance 720-738-0001), day program for individuals with significant disabilities, day program for individuals with developmental disabilities (POSSIBILITIES), day program for seniors (VOYAGES), in0home care: your life your way, Senior move managers (things forgotten not gone, moving service to help seniors moving into aging community/etc); in-home support services, financial support to caregivers for loved ones with disabilities on medicaid (free medical benefits); residential services (individuals with developmental and age-related challenges to remain independent); transitional students support (one-on-one job skills development for preparation for graduation); commercial contract services for businesses. Donation pick ups"
Griffith Center,303-237-6865,https://griffithcenters.org/   info@griffithcenters.org,10190 Bannock St STE 120 80260,"Griffith Centers is a non-profit organization offering a full spectrum of mental and behavioral health services to care for populations who have experienced trauma and hardships to build resiliency, hope, and healing for those we serve. Advocate Kids Success/ASK school and truancy; specialized instruction for students in grades 3-12; outpatient mental and behavioral health services; adults with disabilities services; SUD substance use disorder services; supportive services"
Harrison School District 2,,,,"Prospect Village, through 'We Fortify' will house 18-25 yo young adults facing homelessness ($600/month). Housing for its staff, 'Wendy's Village' ($800/month) "
Harvest Farm,970-568-9803  303-297-1815   970-224-4302,https://www.harvestfarm.org/,Harvest Farm: 80549; Denver Rescue Mission: 80216; Fort Collins: 80524,"Denver Rescue Mission; homelessness unhomed individuals; New Life Program; MEN seeking to exit substance abuse and homelessness. Case Management, work therapy, counseling, spiritual development, education and life skills, christian based"
Helen Hunt Catholic Charities-Family Connections,719-636-2345 719-578-1222,https://www.ccharitiescc.org/tag/helen-hunt-campus/   FamilySupport@CCharitiesCC.org,"917 E Moreno St, Colorado Springs, CO, 80903","Family services, counseling, housing, preschool"
Helping Hands Act,,https://helpinghandsact.com/colorado/?gad_source=1&gclid=Cj0KCQjw0Oq2BhCCARIsAA5hubUL61YEgi4etr8yl9voBxbC6yO54qam8Hp-gEP028_1DqZ5PBM06isaAsySEALw_wcB, ,"housing, utility assistance, transportation, further education, tax preparation, job resources and more."
High Plains Helping Hands/Fresh Start Center,719-495-3123,https://www.freshstartcenter.com/   Facebook: Fresh Start Center,"7375 Adventure Way, C/S, CO 80923?????????","We fight hunger, poverty, joblessness through sustainable agriculture, food distribution, employment programs, nursing support and case management, health services, education for farming and gardening, healthy cooking classes, finance coaching"
Hilltop Latimer House,877-543-9520,https://hilltoplatimerhouse.org/,"Mesa, Montrose, Delta, & Ouray Counties, CO","24/7 crisis line, emergency shelter, case management, & education"
Homebuilders Institute,,hbi.org,,Not for profit that trains future builders in trade and construction skills at no cost to the students to help them attain employment that they can be proud of
Homeless Veterans,877-424-3838,va.gov/HOMELESS/docs/,,"Programs that offer permanent supportive housing for vets; free health care for homeless vets (HCHV) that offers outreach, exams, treatment and case management to help vets rebuild their lives; supportive services for veteran families (SSVF); VA's homeless veterans community employment services (HVCES), job training, career development and employers ready to hire; women veterans program manager "
Homeless Veterans Community Employment Services HVCES,,https://www.va.gov/homeless/hvces.asp,,"improve employment outcomes for Veterans who have experienced homelessness. HVCES has deployed more than 150 Vocational Development Specialists who serve as Community Employment Coordinators (CECs), at most VA Medical Centers across the country."
Hope and Home,719-575-9887,https://hopeandhome.org/,4945 N 30th St 80919,Hope & Home trains and actively supports foster parents all across Colorado who feel compelled by Christ’s command to care for children in need.
Hope House of Sterling,970-380-7885,hopehouseeasternco.org,"217 N Front St Sterling, CO 80751; PO Box 314 Sterling CO 80751","Hope House serving Northeastern Colorado supports men, women and families seeking support either through Hope House and/or a connection to another organization that may support their need. They are one of the WAGEES Community Partners that support CDOC individuals. We have a small housing program which is dedicated to men only at this time. Services include case management, connections to resources, classes, group therapy, faith-based services, life skills, and much more. For an application or more information you may visit their website."
Hungreeapp.com,partnerships@thehungreeapp.com,investors@thehungreeapp.com,,"If you/a restaurant has extra food you can feed the hungry, helps to reduce food waste"
I Matter,,https://imattercolorado.org/,,"Connects youth 18 and younger (and 21 ad younger for those receiving special education services) with a licensed therapist for up to 6 free counseling sessions! No insurance, credit card, or legal status information is required. In person and online."
Impact Empowerment Group,720-819-7150 and 720-394-2341,http://www.impactempowerment.org/,"5405 E 33rd Ave, Denver CO 80207","IEG provides programs in education, employment, and entrepreneurship. They can help you get out of a gang, make different choices, provide mentoring and help finding a job, improve your education, develop a career, become an entrepreneur, and more. Walk-ins are welcome."
Independence Center,719-471-8181,theindependencecenter.org,"729 S Tejon St, 80903","Handicapable assistance; homeless assistance, civil rights for people with disabilities, Disability advocates, home health, CAN program, family payer program, Home Modification, reduced price bus passes, id voucher, non-sober housing voucher: Erika"
Innova Recovery Services,719-419-8909,,"1824 Woodmoor Dr, Ste 101, Monument CO","Substance Abuse SMART Recovery IOP Trauma & PTSD DUI Level I and Level II Classes, Adolescent Therapy Services"
Judi's House,720-941-0331,judishouse.org,,"Judi’s House is dedicated to improving outcomes for bereaved families by strengthening our grief education and program evaluation. JAG Institute, affectionately named after our co-founder’s late mother, Judith Ann Griese, includes our training and research arms. In honor of Judi and all the families we’ve served, we prioritize sharing our findings to have a larger impact on the care grieving families receive in our country."
Junior Achievement Southern Colorado,719-636-2474,https://soco.ja.org/,"611 N Weber St Ste 201, C/S, CO 80903","K-12 students educational enrichment, financial literacy, work and career readiness, entrepreneurship"
K9 to 5,719-238-8118,https://k9to5.com/,,"Private pay, training for service dogs, emotional support animals (dogs) therapy dogs"
Kid Power Colorado,719-520-1311,https://kidpowercs.org/,"2335 Robinson St, Colorado Springs 80904","Kidpower’s mission is to teach young people personal safety and confidence-building skills to reduce their risk of abduction, assault and emotional, physical and sexual abuse. Our programs are known worldwide for being positive, practical, safe and age-appropriate."
Kids Crossing/Roundup School/R Fellowship,719-922-1483,https://www.kidscrossing.com/,,"Foster Care for kiddos, therapeutic foster care, in home services, educational support/tutoring, mobile crisis, TBRI, therapeutic services, financial support, trauma-informed work program, adult care"
Kingdom Builders,719-247-8190 Crisis Line 24/7: 719-464-4647,info@kbflc.org,"411 Lakewood Cir, Ste C-201 C/S, CO, 80910","Advocacy Services for domestic or sexual violence survivors: one-on-one support; safety plans; education about violence; support groups; financial, legal, and housing options; referrals for additional support services"
Legal Assistance (JAG) for military,719-526-6240,https://home.army.mil/carson/support-services/staff-judge-advocate/legal-assistance,Bldg 6222,"The Fort Carson Office of the Staff Judge Advocate Legal Assistance Office provides world class legal advice and service to America's past, present and future warriors and their dependents."
LGBTQIAKPN,,how-to-have-the-talk.org                       you-flourish.com,envision-you-training.org,LGBTQIAKPN mental health resource
Life Network,719-591-2609,https://www.elifenetwork.com/   admin@elifenetwork.com,"3700 Galley Rd, Colorado Springs, CO 80909","Free Pregnancy Services, parenting education, mentorship and counseling, teen suicide prevention"
Life Network Thrift Store,719-344-9904,https://lifenetworkthrift.com/about/   info@lifenetworkthrift.com,"5406 N Academy Blvd, C/S, CO, 80918","Free Pregnancy Services, parenting education, mentorship and counseling, teen suicide prevention"
Lifeline,1-888-225-5322 ASL vid call: 1-844-432-2275,https://www.fcc.gov/general/lifeline-program-low-income-consumers,Washington DC,"low income consumers get free/reduced cost cell phones, landlines, bill help with cell phones, internet at reduced cost"
Living Works,888-733-5484,https://livingworks.net/,Canada and International,Training for suicide prevention and intervention
Lutheran Family Services,719-227-7571,https://www.lfsrm.org/,"108 East St Vrain St, Ste 21, C/S, CO 80903   1515 N Cascade, Colorado Springs, CO 80907","Adoption, pregnancy options, disaster relief, foster care, family support and education, immigration legal services, older adult program, refugees and asylee"
Manitou Art Center,719-685-1861,https://www.manitouartcenter.org/,"513/515 Manitou Ave, Manitou Springs, CO 80829","Music, theatre, pottery, printmaking, and other loud, slightly dangerous, and intensely messy events happen here daily. Locals and tourists alike flock to our galleries, studios, exhibition space, and classrooms. Our spacious facilities can also accommodate events, conferences and offices."
Marion House,719-475-7314,http://www.ccharitiescc.org/,"14 W Bijou St, Colorado Springs, CO, 80903","A soup kitchen, medical partners, Hanifen Employment Center, education, employment skill development, computer training, "
Mental Health Colorado,720-208-2220,https://www.mentalhealthcolorado.org/,"303 E 17th ave Floor 4, Denver, CO, 80203","Strong start for all children, support for families, access to housing supports and services, wellness in aging, reduced potential for harm from alcohol and/or drugs; decriminalize mental health, end discrimination"
Mental Health Technology Transfer Center Network (MHTTC),650-721-8692 701-777-4520,networkoffice@mhttcnetwork.org mountainplains@mhttcnetwork.org [undefined:mountainplains@mhttcnetwork.org],"University of North Dakota 231 Centennial Dr, Stop 7189, Education Building Room 317, Grand Forks, ND 58202","Training, resources and technical assistance to individuals serving persons with mental health disorders. Providers with limited access to service delivery systems w/ attention paid to rural and agricultural communities."
Mercy Medical Angels,,https://www.mercymedical.org/contact-us,,"Non-emergency medical transportation, free, can do via plane, train, bus or car, no insurance needed!!!"
Missing animal response network,,https://www.missinganimalresponse.com/,,Helps train people to recover lost pets
Mission Medical Center,719-219-3402,https://missionmedicalcenter.org/,2125 E LaSalle St 80909,"Free glasses/vouchers for glasses; behavioral health, dentistry, primary care, free medication, free medical supplies, health education, referral services, 1 bus pass"
Modest Needs,844-667-3776,modestneeds.org   doiqualify@modestneeds.org,"120 E 23rd St, FL 5 NY, NY 10010","Modest Needs is a tax-exempt charity where you can make small, emergency grants to low-income workers who're at risk of slipping into poverty and for whom no other source of immediate help is available. We have designed our programs to help those who work hard and have no where else to go for
assistance, as well as those who give back to our communities and country such as public school
teachers, first responders, veterans returning from service abroad and active duty military members.
Our aim is to support those who don’t generally qualify to receive assistance from conventional
agencies so that they don’t find themselves losing everything because of a short-term crisis.
"
Mountain West Financial PATH Home Loan Program, ,mwfinc.com/path/,,"Upfront savings with reduced lender fees and interest rates, can be used with other lender fees and interest rates, can be used with other down payment assistance programs, for members of the Colorado Public Employees' Retirement Assiciation or the Fire and Police Pension Association of Colorado "
Muslim Family Services of Colorado,303-298-8776 After Hours: 303-810-2185,https://mfscolorado.org/,"Aurora, CO","Advocacy, counseling, support groups, education, & emergency assistance (food, clothing, and short-term housing)"
My Colorado Journey,720-273-2944,http://cdhe.colorado.gov/students/preparing-for-college/financial-aid-for-students,N/A,"Free financial education tools, including info on saving and paying for college"
National Cyber Center,,https://cyber-center.org/,"3650 N Nevada Ave, Colorado Springs, CO 80907","The NCC’s Cyber Education Program provides cybersecurity leadership through two main pillars: K-12 education with the NCC Student Alliance, and the Cyber Force Initiative (Adult Education). As our nation addresses the critical gap in skilled cybersecurity talent, NCC addresses the importance of cyber education through programs and partnerships that invite students to participate in an ecosystem which encourages them to learn, explore, and build their skills."
Next Chapter,719-930-6811   888-719-8387,https://www.nextchapterhouse.com/   nextchapter@mtcarmelcenter.org,"530 Communication Cir C/S, CO 80905","Community wellness program serving vets and their families; Health: counseling services, telehealth therapy, support groups, alternative therapies, retreats; Transition and employment: military career transition, employment workshops, milSpouse Career Program, Vet job coaching, community partnership resources; Services: Housing and food aid, financial coaching and assistance, education programs, legal support, homeless vet outreach"
One Colorado,303-396-6170,https://www.one-colorado.org/,"303 E 17th Ave Ste400, Denver CO 80203","Championing equality for LGBTQIAKPN community, state policy, advocacy, health care, education."
One Word at a Time,,https://www.onewordcommunity.org/who-we-are,,Not for profit that encourages literacy in children by connecting classes with authors for virtual visits; professional development opportunities for educators and caregivers; advocacy for independent reading and equitable access to books in schools and public libraries
Open Enrollment,,http://cde.state.co.us/choice/openenrollment,,Allows children to go to a school of choice if they are not in that district
Open Heart Advocates,970-824-2400,https://openheartadvocates.org/about-us/,"Craig, CO","24/7 crisis line, emergency shelter, sexual assault support, mental health resources, human trafficking advocacy, crime victim support, & education"
Operation Pheonix a Grey Team and HOW Foundation Initiative,,https://operationphoenix.greyteam.org/,,"During this operation, we will provide a space for qualified military veterans to gather and gain comfort from the community, learn to effectively train their minds and bodies, optimize their nutrition, decelerate their “fight or flight” response, and enable psychological recovery from the effects of war."
orgcode.com,1-800-355-0420,https://www.orgcode.com/free-resources,Canada,Offers free resource database/training classes/organizational input on how to solve/reduce/prevent homelessness
"Our mission is to proactively support wounded, ill, and injured service members in their recovery, rehabilitation, and reintegration or transition to civilian life. To achieve this, we ensure holistic and tailored support is provided to meet the needs and goals of the service members and their families and caregivers. Disability determinations of seriously ill or injured service members before separating from service. Recovery coordination program: non-medical support they need to create teh life they want. Military caregiver support: provide resources and information. Education and employment initiative, career readiness assistance. Operation Warfighter: internship program",719-352-7190,https://www.centurypa.com/senior-living/bridge-colorado-springs/,"2494 International Cir, 80910",Resources for assissted living
OVC TTAC Office for Victims of Crime Training and Technical Assistance Center,1–866–682–8822,"TAC@ovcttac.org
  https://cpcontents.adobe.com/public/newlearner/newlearner_b346eb25.html?i_qp_user_id=24575422&accountId=65701&newIpUser=true#/newLearnerExperience","1 S Nevada Ave STE 110, Colorado Springs, CO 80903","Free training, online for victim advocacy"
P2P: Parent to parent of Colorado,877-472-7201,https://www.abilityconnectioncolorado.org/p2p-co/,,"1 to 1 trained support parent matching; private on-line discussions group comprised of more than 2,000 caregivers; additional online forum dedicated to caregivers of individuals with mental health and/or behavioral challenges; virtual support groups/book clubs/presentations; public policy advocacy opportunities"
Parents Challenge,719-306-8557,https://parentschallenge.org/  info@parentschallenge.org ,,"Overcoming history of educational failures by parental empowerment, scholarships and grants, student services, community engagement"
