Silver Key Senior Services,719-884-2300,https://www.silverkey.org/,"1625 S Murray Blvd, Colorado Springs, CO, 80916","Senior Resources, resource database, housing, transport, food, appointment, rent assistance, eviction help, moving assistance, medical, co-pay, no back pay, hearing aid assistance, emergency prescription, minor home repairs; Home assistance: 719-884-2300"
SoCo Free Grocery Delivery for Seniors,719-551-2232,office@socoheatingandcooling.com,,
Southern Colorado Retiree Assistance Council,719-556-7153,,"The Hub, Peterson Space Force Base","Military retirees and surviving spouses meeting, second wednesdays"
Storehouse Colorado,719-308-8196,http://www.storehousecolorado.com/,6151 N Academy,"Provide furniture, apliances, household goods, electronics, rugs, lamps, kitchen items, linens, wall hangings and so much more!"
Sunrise Serenity-Pine House,719-219-1862,https://remerg.com/resources/sunrise-serenity-pine-house/,"616 N Pine St, 80905","Sunrise Serenity--Pine House provides safe and sober shared housing for men in a good location. Rooms are shared or private for $500 month. The house requires 12-step meetings, household duties and meetings, and has a zero tolerance policy. Services provided include job coaching. Write to the address for their Resident Intake Form to apply. It is possible to have a bed reserved prior to release. You may also call the number listed for information. There is a scholarship through Hornbuckle Foundation for clients who demonstrate a commitment to the program. Individuals must have their case managers or parole/probation officers call to begin the process with a three-party telephone orientation."
Tamarac Apartments,719-520-9400,,"750 E Cheyenne Rd, Apt 216, Colorado Springs, CO 80905",Senior Housing/Emergency Housing/Affordable Housing
Temporary Assistance for Needy Families,303-866-5700,https://cdhs.colorado.gov/colorado-works   ,"1575 Sherman St, Denver, CO 80203","Cash payment, schooling, training and jobs, elderly, disabilities, children, parents"
TESSA,719-633-3819 Crisis Line 24/7: 719-633-3819,tessacs.org,"435 Gold Pass Heights 80906, 24-hour crisis line, safehouse, victim advocacy (719-633-1462), and OHS liaisons (719-444-8119)","Domestic Violence Survivors Assistance; legal assistance, restraining orders"
Traditions at Colorado Springs,719-419-9353,https://www.traditionsatcoloradosprings.com/?utm_campaign=gmb&utm_medium=organic&utm_source=local,6010 Tutt Blvd Colorado Springs CO 80923,Senior Housing/Emergency Housing/Affordable Housing
Trinith Church,719-599-7990,cstrinity.org,5055 El Camino Dr 80918,"Clothing, household items, food, clothing 4th Saturday January-September, other dates listed"
Two Khings Development LLC,855-305-4464,twokhingsdevelompment.com,"401 N Main st, Ste A, Pueblo 81004","Not for profit that helps seniors and vets with independent living, assisted living, memory care, hestoric preservation projects; working on affordable housing for seniors and vets"
Urban Indian Health,303-953-6600,dihfs.org,"2880 W Holden Ps, 80204????","Denver Indian Health and Family Services (DIHFS) is Denver's only Urban Indian Health Program providing culturally appropriate care for American Indian and Alaska Native adults, children, and families. We serve primarily the Denver Metropolitan area including Adams, Arapahoe, Boulder, Broomfield, Denver, Douglas, Jefferson and Weld Counties. We are uniquely positioned to meet the health needs of our patients in a culturally competent way.  We provide a variety of services including primary care, dental care, behavioral health services, diabetes management/disease prevention, and enrollment in health insurance. We can also help connect you with community partners and resources for all your health needs!"
Villa at Sunny Vista,(719) 635-9595,https://www.sunnyvista.org/living-options/independent-living/,"2480 E Dale St, Colorado Springs, CO 80909",Senior Housing/Emergency Housing/Affordable Housing
Volunteers of America,303-297-0408,https://www.voa.org/ info@voacolorado.org ,"565 Communication Cir Unit #150, 80905","Senior Resource Database for Colorado Springs, housing resources (doesn't matter if the applicant is still getting high, they believe everyone deserves a home), will help furnish home if you qualify for rent assistance"
Volunteers of America CORE,,https://sites.google.com/view/cor3-resources,Colorado Springs,"RESOURCE DATABASE The goal of the VOACO Colorado Rapid Rehousing & Re-entry (COR3) program is to house highly vulnerable households experiencing homelessness, justice involvement, and behavioral health issues, while simultaneously connecting those households to wrap-around support services designed to promote housing stability."
Westernaires,303-279-3767,http://www.westernaires.org/,"15200 W 6th Ave, Unit B Golden, CO, 80401","Westernaires is a mounted precision drill organization composed of Denver-area youngsters from 9 to 19 years of age. Founded in 1949, Westernaires has provided training in western riding, precision drills, and horse care for over 70 years. Some members also elect to receive training in specialty acts such as trick riding, roman riding, and dressage."
Wyndam Place Senior Residences,719-635-4832,https://www.beacon.cc/wyndam-cosprings.html,"725 S Weber St, Colorado Springs, CO, 80903",Senior Housing/Emergency Housing/Affordable Housing
Your Life Your Way In-Home Care,719-635-4483,https://goodwillcolorado.org/services/in-home-care/?gad_source=1&gclid=Cj0KCQjw0Oq2BhCCARIsAA5hubUzwM3_ZPdA5BMyFtj1_y6nu-ZV3gMcfdTftke4ws_2ePV9CAVY6b8aAmZKEALw_wcB,1460 Garden of the  Gods Rd 80907,Goodwill In-Home Care for seniors and Medically in-need individuals