Name/Title,Ph. Number,Web Address/Email,Phys. Address,Why would you contact them?
Harry Potter,7-859-444,HP@MOM.gov,"12 Grimald Pl London, England",Dementor Infestation
A Little Help,720-242-9032,https://alittlehelp.org/,"Denver, CO",Denver based volunteers help elderly with their getting around to help prevent isolation among the senior community
Adopt Us Kids,719-428-6100,https://adultcommunityservices.com/,"5390 N Academy Blvd #200, Colorado Springs, CO 80918","Case Management, Life-skills, In-home therapy for adults/seniors with mental health"
Adult Community Services,719-444-5755,,,"If an at-risk adult (senior/mentally/physically unable to take care of themselves) is being abused/taken advantage of, call these people)"
Almost Home,303-659-6199,https://www.almosthomeonline.org/,,"Services for Adams, Broomfield, Sourthern Weld Counties housing resource database; emergency assistance, guaranteed income for older adults, housing navigation center, housing stability program, emergency family shelter, severe weather program, street outreach program, respite housing program, rapid re-housing programs, workshops"
Alternative to TANF,719-428-6100,admin@adultcommunityservices.com    http://adultcommunityservices.com/,"5390 N Academy Blvd #200, Colorado Springs, CO 80918",Medicaid and Medicare clients: in-home therapy available; 
Amazon Worker Whereabouts,888-892-7180,,,"If a client is working in an amazon warehouse and you need to do a whereabout call, call this number to be connected with a work verification specialist and it will give you real time updates about his location at work; has a program to give homeless the gear to make it through the winter cold."
Americorps,800-942-2677,americorps.gov,nationwide,"Federal agency for national service and volunteerism. From mentoring students to supporting disaster recovery, helping older adults age with dignity and tackling other pressing needs, AmeriCorps helps communities across the country. Was defunded by DOGE, reinstated beginning of 2025."
Angel Tree,719-382-1182,https://saangeltree.org/,"May change for this year, 208 Cunningham Dr, 80911","Provides Christmas gifts through Angel Tree to seniors and children in need. Once you have been accepted into the program an Angel will receive your submitted Christmas Wishlist and donors in the community will purchase the new clothes and gifts. Requirements: provide photo ID, proof of residence (envelope?) id for child (birth certificate), detailed info about your request"
Angel's of America's Fallen,719-377-7352,http://www.aoafallen.org/,,"""Angels of America’s Fallen is a 501(c)(3) that empowers children of fallen military, police, fire, and EMS heroes by engaging them in positive activities throughout their entire childhood. We support the children not just one time, but through a commitment to see them engaged positively in healthy activities such as sports, music, and other arts all year, every year, all the way through 18 years old without having to reapply. These provided activities have coaches or instructors who can help provide some positive mentoring the children are missing without the guidance and support of their fallen hero. We also provide trauma-informed client-centered case management, peer support for the surviving parent and children, outreach and referrals."""
Army Emergency Relief,888-878-6378,https://www.armyemergencyrelief.org/,"Arlington, VA","To provide grants, interest-free loans and scholarships to promote readiness and help relieve financial distress of Soldiers and their Families."
Army Military Pay Office,719-526-4084 719-526-1052,https://home.army.mil/carson/allservices/army-military-pay-office,"1676 Evans Ave Building 1220, first floor",Soldiers whose LES shows 'no pay due'; direct deposit did not post to their bank; allotment did not reach the intended recipient; garnishment payment did not reach the intended recipient; LES reflects a debt they do not understand or are doing business for (cash collection payments); RC/NG SM starting or ending tours of 30 days or longer; MyPay password reset
Assissted Living Guide,,https://www.assistedliving.org/emergency-housing-guide/,,Help with assissted living for seniors
Benefits Checkup,800-794-6559,benefitscheckup.org,,"Connects millions of older adults and people with disabilities with benefits programs that can help pay for health care, medicine, food, utilities and more; resource database"
Career One High School,719-531-6333,https://pikespeak.careeronlinehs.org/how-it-works/,https://ppld.org/cohs,Career Online High School (COHS) is an online high school diploma and career certification program funded by Pikes Peak Library District. Residents living within the Library District’s service area who have completed eighth grade and are age 18 or older are eligible to apply. Ready to get started?
Cars for Charity Inc. (FreeCharitycars.org ),720-387-5124,http://www.carsforcharity.net/   amandagearhart@carsforcharity.net,"3478 Running Deer Dr, Castle Rock, CO 80109","Cars for Charity, Inc. is a Colorado 501(c)3 non-profit organization. The purpose and mission of Cars for Charity, Inc. is to act as an enabling entity for other non-profit organizations. Many non-profit organizations are unable to have an in-house vehicle donation program, because they financially are unable to spend the money required by the Colorado Department of Revenue to obtain a Dealer's License, bond and do not have the staff, time and expertise to manage an in-house program. Cars for Charity, Inc. eliminates these obstacles. Cars for Charity holds the Dealer's License, the motor vehicle bond, and brokers the donated vehicles to the appropriate facility for direct sale, auction or as scrap."
Colorado School of Mines,303-273-3000,https://www.mines.edu/,"1500 Illinois St, Golden, CO 80401",Lake County: helping lower utility bills by upgrading outdated systems for low income families and those in trailer parks
Colorado Springs Mom Collective-Family Connections-Catholic Charities,719-531-9400,https://cospringsmom.com/directory/listing/peak-parent-center?tab=related&view=map&category=0&zoom=15&is_mile=0&directory_radius=0&sort=oldest&p=1#sabai-inline-content-related,"917 E Moreno Ave Ste 140, 80903","Map of parent centers, fun events calendar"
Colorado Springs Senior Center,719-387-6000,csseniorcenter.com,1514 N Hancock Ave 80903,Provides leisure space and activities for seniors
Colorado Springs Senior Dog Rescue and Hospice,info@coseniordogrescue.org!,https://coseniordogrescue.org/resources/,,resource database for animals
Colorado Springs Silvercrest Senior Residence,(719) 389-0329,https://seniorsbluebook.com/senior-housing/silvercrest-senior-residence-colorado-springs-co,"904 Yuma St, Colorado Springs, CO 80909",Senior Housing/Emergency Housing/Affordable Housing
Community Action Partnership,,https://communityactionpartnership.com/our-impact/,,"Resource Database. Embodying our nation’s spirit of hope, America’s Community Action Agencies are a robust state and local force – reaching children and families in 99% of our nation’s counties with life-changing services, from early childhood education to job training services for seniors."
Computers with Causes,720-278-7725   888-228-7320,https://www.computerswithcauses.org/computer-donation-colorado/,"6035 E 38th Ave, Denver, CO, 80207","Tech classes, internet devices, recycling old tech, internet solutions, tech support for all low income/not for profit/families and individuals, tax deduction mentioned for donations   NFP that gives computers, internet tech/etc to under priviledged families/individuals/nfp/schools/etc"
"Cool Down, the",,https://guide.thecooldown.com/explore/,,An eco-friendly guide on resources and how-to-guides for how to repurpose your life and its products to be more eco-friendly and economically viable in the long run.
Defense Finance and Accounting Service,888-332-7411,https://dfas.mil/,"Military, retired & annuitant, civilian employee, contractor and vendor",Providing payment services for the department of defense
Domiciliary Care for Homeless Vets DCHV,1-877-424-3838,https://www.va.gov/homeless/dchv.asp,,"24/7 residential medical support to help veterans rebuild their lives; The Domiciliary Care Program is the Department of Veterans Affairs (VA) oldest health care program. Established through legislation passed in the late 1860's, the Domiciliary's purpose was to provide a home for disabled volunteer soldiers of the Civil War. Domiciliary care was initially established to provide services to economically-disadvantaged Veterans, and it remains committed to serving that group. The Domiciliary has evolved from a ""Soldiers' Home"" to become an active clinical rehabilitation and treatment program for male and female Veterans and domiciliary programs are is now integrated with the Mental Health Residential Rehabilitation and Treatment Programs (MH RRTPs)."
Early Connections Learning Centers,719-632-1754,earlyconnections.org,"104 E Rio Grande St, C/S, CO 80903","Children aged 6-16 years old: offering nationally accredited programs featuring a literacy-focused curriculum, family support activities, nutritious meals and snacks, physical and behavioral health support, and a team of highly qualified professionals."
Emergency Medicaid,800-221-3943,https://www.healthfirstcolorado.com/emergency-medicaid/,,"This is exactly as it says, it’s emergency Medicaid. That means that it’ll take awhile to get ahold of, no joke, may take a few hours."
Energy Resource Center,719-591-0772,erc-co.org,"540 E Cimarron St, Colorado Springs, CO, 80903","Not for profit that helps people check for energy consumption, household carbon footprint, home safety and detection, home insulation, appliance efficiency, solar solutions; save money on energy costs, cut energy waste, assist with affordable housing crisis, application for benefits or weatherization program, energy assessments, post-energy assessment steps, completion of work, final inspection, resource database for energy efficiency"
Envida Cares,719-633-4677,https://envidacares.org/,infomoves@envidacares.org,Medicare patients free medical rides
Families Matter,,Link to Families Matter Documents Folders Page,,"All rules and regs for child welfare, have to have access to access papers, all paperworks you could use"
Financial Readiness Program,719-526-4783,https://myarmybenefits.us.army.mil/Benefit-Library/Federal-Benefits/Financial-Readiness-Program-(FRP),,"The Army's Financial Readiness Program (FRP) is available at every installation. Army Community Service (ACS) FRP teaches Soldiers in both classroom training & individual counseling sessions, how to save and invest their money, how to establish savings goals, debt elimination strategies, and saving for emergencies. Through partnerships with non-profit corporations, many of these tools and resources are provided online for those geographically separated from an ACS office. Contact your local installation ACS center or Family Service Center for more information."
Flying Horse Foundation,303-660-3583,flyinghorsefoundation.org   info@flyinghorsefoundation.org,"9663 E Palmer Divide Ave, Larkspur CO 80118","assists at-risk and underserved children through equine-assisted learning. senior program serves residents who would enjoy getting out of their environment to experience the open skies, fresh and airy serenity; El Paso Couty, Douglas County resource database, foster and adoptive family resources, develpmental relationships framework, surrounding activities"
Folds of Honor,coloradopatriots.foldsofhonor.org,https://foldsofhonor.org/,"Parker CO closest branch, does come to springs coloradopatriots@foldsofhonor.org",Chapters that hold fundraisers that give scholarships to surviving children of first responders and military
"For Applicants of SSI, temp $",303-333-3482,http://coloradopeak.secure.force.com/,Details: https://www.senioranswers.org/financial-resources/and-ab/,"$200 a month for those applying for SSI/etc, 18-60 yo, click the check the 'adult financial' assistance box on the standard medicaid application"
For Pride and Honor,,https://4pahorg.wixsite.com/forprideandhonor,4pahoperations@gmail.com,"Displace, disabled, retired veterans receive laundry assistance, hygiene, clothing, project homefront contributor, support groups and employment referrals"
Fountain Gardens Senior Living,719-632-2155,http://www.dunmire.net/property/121/,"3165 E Fountain Blvd, Colorado Springs, CO 80910",Senior Housing/Emergency Housing/Affordable Housing
Fountain Valley Senior Center,719-600-2644,fvscenter.org,"5745 Southmoor Dr, Fountain CO 80817",Senior center that will lend out mobility/handicapable tools/etc to those in need i.e. toilet chair with handles
Franklin Square Townhomes,,https://csha.us/franklin-square,"605 N Franklin St, Colorado Springs, CO 80903",Senior Housing/Emergency Housing/Affordable Housing
Gerofit,,https://www.va.gov/GERIATRICS/pages/gerofit_Home.asp,,Fitness program for senior veterans offered by VA to those already under their care
Go Farm,720-580-3276,gofarm.org,"1301 Arapahoe St. Ste 105, Golden, CO 80401",Helps backyard farmers in building their crops in an eco-friendly and local co-op friendly manner
Golden Lotus Foundation Asian Heritage Center,719-540-5338,https://www.goldenlotusfoundation.org/?utm_source=google&utm_medium=organic&utm_campaign=gbp,"1819 W Cheyenne Rd, C/S, CO 80906","NFP for cultural activities, publications"
Good Neighbor Garage,720-941-5897,goodneighborgarage.com  care@ehands.org   info@goodneighborgarage.org,"16097 S Golden Rd, Golden, CO, 80401","GNG is a unique car donation program as it is one of few charities in Colorado, which allows you to claim the full-market value of your donated car. When you donate to GNG, you can maximize your tax deduction making it a win-win for all! If you have additional questions, or if you would like to find out more about donating your vehicle to Good Neighbor Garage, please contact us at (720) 941-5897 or email GNG at info@goodneighborgarage.org"
Goodwill Resources,,https://goodwillcolorado.org/services/,,"Resource database of what's offered by goodwill. Help with farmers/ranchers, developmental, aging challenges, independence in agriculture trade and commerce; job training and support, LEAP (low-income energy assistance program); information technology training A+ cert, network + cert and security + cert for comptia; career development services, youth education/career development, mentoring, soft skills, work opportunities for those with disabilities (custodial), child support/improved payments and child success (impacs 303-412-3150), educational and social integration for refugee youth (CLIMB 720-392-8242), work skills and family stabilization (colorado works/tanf), soft and practical skills training (self-esteem, self-motivation, personal responsibility and reliability, cultural diversity and acceptance 720-738-0001), day program for individuals with significant disabilities, day program for individuals with developmental disabilities (POSSIBILITIES), day program for seniors (VOYAGES), in0home care: your life your way, Senior move managers (things forgotten not gone, moving service to help seniors moving into aging community/etc); in-home support services, financial support to caregivers for loved ones with disabilities on medicaid (free medical benefits); residential services (individuals with developmental and age-related challenges to remain independent); transitional students support (one-on-one job skills development for preparation for graduation); commercial contract services for businesses. Donation pick ups"
Habitat for Humanity,719-667-0840,http://pikespeakhabitat.org/   office@pikespeakhabitat.org   donations@pikespeakhabitat.org,6250 Tutt Blvd,"vehicle for certain people, can donate old vehicles, builds and improves affordable housing, restore offers inexpensive construction and household items, furniture; Women Build helps women to learn to build and repair homes"
Hands of the Carpenter,303-526-4488,https://www.handsofthecarpenter.org/,"16097 S Golden Rd, Golden CO 80401",Car repair/vehicles for single mothers
Hatler-May Village Senior Residences,(719) 354-4743,http://www.cchnc.org/,"2842 Vickers Dr, Colorado Springs, CO 80918",Senior Housing/Emergency Housing/Affordable Housing
Housing and Urban Development HUD Resource Map,,resources.hud.gov,,"Resource database in map form, find: affordable housing, HUD office, Public Housing Authority, Homeless Resources, Affordable Elderly and special needs housing and more"
Justice Center C/S,719-473-6212,https://www.justicecentercos.org/apply    media@justicecentercos.org ,,Lawyer Referral: No court date within 6 weeks; priority persons: survivors of family violence; honorably discharged vets and dependants; active duty members; persons with disabilities; senior citizens; immigrants and refugees; persons with landlord/tenant issues
Kid's Closet Swap,,https://www.facebook.com/events/595272426387355/,4863 N Nevada Ave 80918,0-12 year old kid closet swap
Launchpad Apartments,719-427-2609,https://www.thelaunchpadapts.com/,"846 N 19th St, C/S, CO","Run by 'the Place' and is affordable and supportive housing for 18-24 yo to help them turn their lives around; free of charge, paid for by Colorado Division of Housing; 13% for homeless vets paid by state vouchers; Seniors earning 40-60% median income will fill other units"
Lutheran Family Services,719-227-7571,https://www.lfsrm.org/,"108 East St Vrain St, Ste 21, C/S, CO 80903   1515 N Cascade, Colorado Springs, CO 80907","Adoption, pregnancy options, disaster relief, foster care, family support and education, immigration legal services, older adult program, refugees and asylee"
Medallion Post Acute Rebilitation Clinic,719-381-1000,http://medallionparc.com/,"1719 E Bijou St, C/S, CO 80909","In-house therapy, skilled nursing, senior living, active living"
Medicare Bus Passes,303-444-3043   719-471-8181,https://coloradosprings.gov/mountain-metro/fares-and-tickets-hub,729 S Tejon St 80903,"In the medicare application, you can buy single use, day and multiple bus passes for REAL cheap"
Medicare Transport,720-665-4449,https://www.mdttransit.com/medicare-ride-service-colorado-springs5e4be744, ,Free transport for medicare recipients
Mental Health Transitional Living,303-866-5170,cdhs)admissions.mgtl@state.co.us  cdhs.colorado.gov    https://cdhs.colorado.gov/mental-health-transitional-living-homes,"3824 W Princeton Cir, Building 15, Denver, CO 80236","helps with food, meds, no benis or money needed, not used within 3 months usually, NO SO, if they required locked facility, none if on M1 hold, Level 2 Home will take people out of detox, acute crisis interventions within 6 or less months. Has SI/HI in last 6 months, actively trying to harm themselves within last 6 months. Homes staffed 24/7 with QMAP. Staff are cooking and basic cleaning, most need to keep up with their own ADL, unlocked doors and hands off. Intensive case manager. Optional programs. So long as they're not decomping/isolating. They pay first, work on getting them on waivers with SSI/medicaid/etc/hcbs; needs 6 month mental health history; new homes opening up with less criteria including only 3 month mental health history, dogs?"
Military Emergency Financial Assistance,877-272-7337,http://redcross.org/colorado,1040 S 8th St,Provides some financial assistance for active duty military and retired military in emergencies. Assistance includes:
Mountain Springs Recovery,844-481-0693,https://mountainspringsrecovery.com/elderly-drug-addiction-and-treatment/,"1865 Woodmoor Dr, Monument, CO 80132",Elderly addiction rehab
Mountain West Financial PATH Home Loan Program, ,mwfinc.com/path/,,"Upfront savings with reduced lender fees and interest rates, can be used with other lender fees and interest rates, can be used with other down payment assistance programs, for members of the Colorado Public Employees' Retirement Assiciation or the Fire and Police Pension Association of Colorado "
Myron Stratton Senior Living,(719) 579-0930,http://www.myronstratton.org/,"2525 CO-115, Colorado Springs, CO 80906",Senior Housing/Emergency Housing/Affordable Housing
National Runaway Switchboard,800-RUNAWAY,,,Active duty military and retired military members
No Small Acts,,nosmallact.com,,"Information and Resource Database for political information and lists of way to access older information, political movement"
Old Age Pension,,https://cdhs.colorado.gov/adult-financial-programs,,"Income for needy, disabled, elderly."
Old mutt Hut,,https://theoldmutthut.org/,,A forever home for abandoned senior dogs
Operation Helping Hands,,FFCOChaplainRMTeam@army.mil,,Program managed by the Fort Carson Religious Support Office providing immediate and direct support for soldiers and their families facing food insecurity.
"Our mission is to proactively support wounded, ill, and injured service members in their recovery, rehabilitation, and reintegration or transition to civilian life. To achieve this, we ensure holistic and tailored support is provided to meet the needs and goals of the service members and their families and caregivers. Disability determinations of seriously ill or injured service members before separating from service. Recovery coordination program: non-medical support they need to create teh life they want. Military caregiver support: provide resources and information. Education and employment initiative, career readiness assistance. Operation Warfighter: internship program",719-352-7190,https://www.centurypa.com/senior-living/bridge-colorado-springs/,"2494 International Cir, 80910",Resources for assissted living
Paloma Gardens now called Laurel Gardens,719-227-7162,http://www.voacolorado.org/housing_properties/laurel-gardens,3140 Mallard Dr 80910,"Senior living for 62+, affordable, run by volunteers of America, looks depressing from the outside in person and online"
Partners in Housing,719-473-8890,partnersinhousing.org office@partnersinhousing.org,455 Gold Pass Heights 80906,"Single parent sober living (limited occupancy), furniture from donations (free), meets minimum employment requirements to get your benefits reinstated if DHS cancels them due to lack of employment"
Patient Access Network Foundation,866-316-7263,https://panfoundation.my.site.com/s/login,"1032 15th St NW, Ste 413, DC","Offers grants to assist with out of pocket medication copay costs, Health Insurance Premiums, Transport for activities that benefit overall health; income below/at federal poverty level, dependent on household size, reside in US, tx in US, receiving treatment/prescribed covered by fund"
Pikes Peak Area Agency on Aging,,https://ppacg.org/pikes-peak-area-agency-on-aging/,,"help older people live independently in their own homes. Funding for services comes through the federal Older Americans Act and the State of Colorado. A person must be 60 years of age or older, some exceptions"
Pikes Peak Odd Fellows Housing,(719) 632-1556,,"1912 Eastlake Blvd, Colorado Springs, CO 80910",Senior Housing/Emergency Housing/Affordable Housing
Polygamy Survivors,,holdingouthelp.org,,For those that have survived polygamy
Rocky Mountain Health Care Services,,,,Helps elderly and those with physical health issues to gain independence
Rocky Mountain PACE Program of All-inclusive Care for the Elderly,855-207-0702  719-314-2327,https://rmpace.org/,"8595 Explorer Dr C/S 80920   2502 E Pikes Peak Ave Ste #100 C/S, CO 80909","Coordinated and all-inclusive health care for the elderly: Social, adult day/health center, recreational activities, educational classes; Support: transportation, CM to coordinate services, home health care, personal care and laundry services, respite care; Wellness: nutritious meals and snacks, homemaker services, recreation therapy, counseling, home health care, medication, physical tx; Medical: physical and occupational therapy, emergency, hospital and nursing home care when needed, all necessary Rx with no co-pay, medical specialists, med clinic with Dr and nurses, skilled home health care"
Safe Place for Pets,,https://www.safeplacepets.org/,,"Adoption service for pets from terminally ill individuals, especially older cats."
Salvation Army (for families only)/Family Hope Center,719-578-9190 719-635-1287,coloradosprings.salvationarmy.org pstock.tsa@gmail.com https://www.salvationarmyusa.org/usn/home/#whatwedo,"709 S Sierra Madre St, Colorado Springs, CO, 80903","Families shelter (children under 18), 90 day facility, get housing, case workers ONLY IF IN PROGRAM; Fountain has more financial resources that C/S branch; holiday gifts, rent, utility, food, rehab, summer camps, disaster relief, lgbtqiakpn support, domestic abuse, elderly, job training, veteran, life skills, human trafficking"
Section 202,,http://www.hud.gov/program_offices/housing/mfh/progdesc/eld202,,"Housing for the elderly, unassisted, sign up through qualifying/participating property managers directly"
Senior Blue Book,,,,"Resource Database/book for seniors, senior living"
Senior Community Services Employment Program (AARP),719-635-3579,,,Helping Seniors find work
Senior Insurance,719-471-7080   719-471-2096,https://ppacg.org/pikes-peak-area-agency-on-aging/senior-insurance/,"15 S 7th St, C/S, CO 80905   14 S Chestnut C/S, CO 80905",Elderly insurance information
Senior Mobile Dental,719-310-3315,https://communitydentalhealth.org/,,Dental care for seniors brought to their homes
Senior Services,,https://srchope.org/senior-services/,https://srchope.org/wp-content/uploads/Senior-Services.pdf,"Senior Resource database, will update in 2025, downloaded"
Senior Yellow Book,719-471-2096,https://ppacg.org/yellowbook/2023-yellow-book/,14 S Chestnut 80905,Resource database for seniors
Senior/disabled housing list,,https://ccdenver.org/housing/senior/,,Affordable housing-only one local-for seniors and the disabled.
