Medicare Transport,720-665-4449,https://www.mdttransit.com/medicare-ride-service-colorado-springs5e4be744, ,Free transport for medicare recipients
Medline Plus,,medlineplus.gov,,"an information database for health info patients and their families and friends, medical library, part of the National Institutes of Health"
Mental Health Colorado,720-208-2220,https://www.mentalhealthcolorado.org/,"303 E 17th ave Floor 4, Denver, CO, 80203","Strong start for all children, support for families, access to housing supports and services, wellness in aging, reduced potential for harm from alcohol and/or drugs; decriminalize mental health, end discrimination"
Mental Health Support Line,988 Mental Health/SUD/emotional concerns,https://988lifeline.org/,Nationwide,mental health/emotional/substance abuse concern help line 24/7; dial 1 for VET crisis line
Mental Health Technology Transfer Center Network (MHTTC),650-721-8692 701-777-4520,networkoffice@mhttcnetwork.org mountainplains@mhttcnetwork.org [undefined:mountainplains@mhttcnetwork.org],"University of North Dakota 231 Centennial Dr, Stop 7189, Education Building Room 317, Grand Forks, ND 58202","Training, resources and technical assistance to individuals serving persons with mental health disorders. Providers with limited access to service delivery systems w/ attention paid to rural and agricultural communities."
Mental Health Transitional Living,303-866-5170,cdhs)admissions.mgtl@state.co.us  cdhs.colorado.gov    https://cdhs.colorado.gov/mental-health-transitional-living-homes,"3824 W Princeton Cir, Building 15, Denver, CO 80236","helps with food, meds, no benis or money needed, not used within 3 months usually, NO SO, if they required locked facility, none if on M1 hold, Level 2 Home will take people out of detox, acute crisis interventions within 6 or less months. Has SI/HI in last 6 months, actively trying to harm themselves within last 6 months. Homes staffed 24/7 with QMAP. Staff are cooking and basic cleaning, most need to keep up with their own ADL, unlocked doors and hands off. Intensive case manager. Optional programs. So long as they're not decomping/isolating. They pay first, work on getting them on waivers with SSI/medicaid/etc/hcbs; needs 6 month mental health history; new homes opening up with less criteria including only 3 month mental health history, dogs?"
Mentally Strong,719-493-9555,https://www.mentallystrong.com/contact-us/,"3720 Sinton Rd. Ste 104, Colorado Springs, CO, 80907","Mental Health provider, ""Psychiatric Assessments Medication Management, Vivitrol, Art Therapy"""
Mercy Medical Angels,,https://www.mercymedical.org/contact-us,,"Non-emergency medical transportation, free, can do via plane, train, bus or car, no insurance needed!!!"
Metanoia Shelter,,https://www.findhelp.org/metanoia%252C-inc.--zachary-la--metanoia-refuge/5811770958675968?postal=80918,,"Metanoia offers a place of refuge to female adolescent victims of human trafficking, in which to heal physically and mentally. The program provides girls aged 11-17 with mental, physical, and."
Metro Caring,303-860-7200,info@metrocaring.org  https://metrocaring.org/services/id-vouchers/,"1100 E 18th Ave, Denver CO 80218",Free transport for medicare recipients
Mile High Behavioral Health,303-825-8113,,"4242 Delaware St, Denver 80216","OP Co-occuring, shelter"
Military Health System,800-214-8819,https://www.mhsnurseadviceline.com/home,"Nurse advice line for those with Department of Defense Benefit Number, call/chat via text/online/video calls via link",
Mission Medical Center,719-219-3402,https://missionmedicalcenter.org/,2125 E LaSalle St 80909,"Free glasses/vouchers for glasses; behavioral health, dentistry, primary care, free medication, free medical supplies, health education, referral services, 1 bus pass"
Modest Needs,844-667-3776,modestneeds.org   doiqualify@modestneeds.org,"120 E 23rd St, FL 5 NY, NY 10010","Modest Needs is a tax-exempt charity where you can make small, emergency grants to low-income workers who're at risk of slipping into poverty and for whom no other source of immediate help is available. We have designed our programs to help those who work hard and have no where else to go for
assistance, as well as those who give back to our communities and country such as public school
teachers, first responders, veterans returning from service abroad and active duty military members.
Our aim is to support those who don’t generally qualify to receive assistance from conventional
agencies so that they don’t find themselves losing everything because of a short-term crisis.
"
Mountain Springs Recovery,844-481-0693,https://mountainspringsrecovery.com/elderly-drug-addiction-and-treatment/,"1865 Woodmoor Dr, Monument, CO 80132",Elderly addiction rehab
Mr. Ballen Foundation,,https://mrballen.foundation/,,"A fund for victims of violent crimes and the families of the victims, only accepting referrals from our partner org or other victim advocacy professionals. Meant for victims of rape, genocide, homicide, violent crimes against children, sex trafficking, arson, or robbery resulting in death.To be considered, you must apply on the links provided under 'Report a Crime', 'Report Human Trafficking'."
"Nation Indian Council on Aging, Inc.",,https://www.nicoa.org/programs/technical-assistance-and-resource-center/,,May be able to help with hearing aids/medical expense costs
National Craniofinancial Association,800-332-2373,http://faces-cranio.org/financial-assistiace,N/A,Financial assis for med necessary travel to out of town tx for craniofacial cond for indiv and families with monetary barriers to reaching care
National Healthcare for the Homeless Council,,,,
National Mobility Equipment Dealers Association,1-813-264-2697,https://nmeda.org/   info@nmeda.org,FL,"Transport resources for handicapable vehicles and transportation, resource database"
National Organization for Rare Disorders,800-999-6673,http://rarediseases.org/,"7 Kenosia Ave, Danbury CT",Financial Assis for medical expenses for those that suffer from rare diseases
Neighborhood Justice Center,,https://www.4thjudicialda.com/NeighborhoodJustice.html   daonjc_info@elpasoco.com ,"105 East Vermijo Ave, 2nd Floor, Room 230",Mediation services for clients that are going in for a court case to express their role and perspective in order to possibly avoid it going to court for the person's issues and concerns.
Next Chapter,719-930-6811   888-719-8387,https://www.nextchapterhouse.com/   nextchapter@mtcarmelcenter.org,"530 Communication Cir C/S, CO 80905","Community wellness program serving vets and their families; Health: counseling services, telehealth therapy, support groups, alternative therapies, retreats; Transition and employment: military career transition, employment workshops, milSpouse Career Program, Vet job coaching, community partnership resources; Services: Housing and food aid, financial coaching and assistance, education programs, legal support, homeless vet outreach"
Nursecore,719-262-0300,nursecore.com,5043 N Academy Blvd 80918,"CNA, MA, LPN, RN"
Office of Family Assistance,www.acf.hhs.gov/ofa,https://www.acf.hhs.gov/ofa,330 C St SW DC 20201,"Federal guide for grants and resources, native americans/healthy marriage and responsible fatherhood, tribal programs, indigenous resources/resource guide Native American family based assistance"
One Colorado,303-396-6170,https://www.one-colorado.org/,"303 E 17th Ave Ste400, Denver CO 80203","Championing equality for LGBTQIAKPN community, state policy, advocacy, health care, education."
Open bible medical,719-475-0972   719-596-4449,https://openbiblemedical.org/,"555 E Costilla St, 80903 Tuesdays 5-9 pm; Thursdays 10 am to 2 pm Saturdays 9 am to 1 pm","Pharmacy, free access to medical care and life saving medications to the uninsured, low income"
Open Heart Advocates,970-824-2400,https://openheartadvocates.org/about-us/,"Craig, CO","24/7 crisis line, emergency shelter, sexual assault support, mental health resources, human trafficking advocacy, crime victim support, & education"
Operation Helping Hands,,FFCOChaplainRMTeam@army.mil,,Program managed by the Fort Carson Religious Support Office providing immediate and direct support for soldiers and their families facing food insecurity.
Operation TBI Freedom,855-355-6824,https://craighospital.org/programs/operation-tbi-freedom,,
Optum Primary Care,522-1133,600 S 21st St,,PCP accepts Medicaid
"Our mission is to proactively support wounded, ill, and injured service members in their recovery, rehabilitation, and reintegration or transition to civilian life. To achieve this, we ensure holistic and tailored support is provided to meet the needs and goals of the service members and their families and caregivers. Disability determinations of seriously ill or injured service members before separating from service. Recovery coordination program: non-medical support they need to create teh life they want. Military caregiver support: provide resources and information. Education and employment initiative, career readiness assistance. Operation Warfighter: internship program",719-352-7190,https://www.centurypa.com/senior-living/bridge-colorado-springs/,"2494 International Cir, 80910",Resources for assissted living
Over the Rainbow Project,720-580-2696,overtherainbowproject.com,info@overtherainbowproject.com,"LGBTQ+ Re-entry support services: seeking safety, wellness recovery action plan, life skills, parenting, moral reconation therapy (MRT), art recovery, the art of drag, spirituality, recovery yoga, equine recovery therapy, themed group activities, individual therapy, peers"
Oxford House of Colorado,,oxfordhouseco.org,oxfordvacancies.com,Sober living;mpowering peer-ran atmosphere that supports healthy lifestyle practices and comradery for those seeking long-term recovery
P2P: Parent to parent of Colorado,877-472-7201,https://www.abilityconnectioncolorado.org/p2p-co/,,"1 to 1 trained support parent matching; private on-line discussions group comprised of more than 2,000 caregivers; additional online forum dedicated to caregivers of individuals with mental health and/or behavioral challenges; virtual support groups/book clubs/presentations; public policy advocacy opportunities"
PACT ACT,,,,2022 law that widened access to benefits for veterans care that were exposed to burn pits during thier deployments get extra tx help wth the resulting cancer
Parent Smart Helpline,720-777-0123,,,"Free, 24 hrs with nurse, has to be witin Colorado, any medical questions"
Parole Continuity of Care Referral and tx coord. framework,,CDOC Parole Continuity of Care Referral and Treatment Coordination Framework.pdf,,How parole should work on building up parole clients treatment so there's no big gap in care
PASCO Personal Assistance Services of Colorado,719-960-4995,https://pascohh.com/,6385 Corporate Dr Ste 303 80919,"Helps those with special needs/mental health needs by offering: training families for becoming caregivers/CNAs, in home support services, respite care, care plans that are client directed, veterans care/their spouses, private duty nursing, therapy for children and family, "
Pathways to Removing Obtacles o Housing (PRO Housing),,hud.gov/press/press_releases_media_advisories/hud_no_25_017,,Help with breaking past barriers to building/rebuilding/repairing/creating/converting buildings into housing
Patient Access Network Foundation,866-316-7263,https://panfoundation.my.site.com/s/login,"1032 15th St NW, Ste 413, DC","Offers grants to assist with out of pocket medication copay costs, Health Insurance Premiums, Transport for activities that benefit overall health; income below/at federal poverty level, dependent on household size, reside in US, tx in US, receiving treatment/prescribed covered by fund"
Peak View Behavioral Health,719-694-0220,https://peakviewbh.com/,"7353 Sisters Grove, C/S, CO 80923","Mental/behavioral/psychiatric assistance, inpatient and outpatient, for youth as well, detox, takes medicaid, tricare, medicare, private, cash"
Peak Vista,719-632-5700,https://www.peakvista.org/,https://www.peakvista.org/locations,"Will take patients even if they can't pay, free/sliding scale; https://www.peakvista.org/services/first-visitor : Our First Visitor program provides FREE, one-on-one support for parents and caregivers in the comfort of their own home. We provide emotional support, connect parents and caregivers with free community resources, and share information on health, nutrition, safety, and important developmental milestones. First Visitor partners with Zero To Three, a statewide organization that provides our evidence-based materials and together our purpose is to help make Colorado the best place to raise a child under the age of five. free home visits which include gift for baby/toddler, info on child development, dey tag w/ age-appropriate activities, community resources"
Peaks Recovery Centers,719-345-1025,https://peaksrecovery.com/?utm_campaign=gmb,2270 La Montana Wy Ste 200 80918,"Substance Abuse Alcohol Abuse Trauma and PTSD Treatment Services offered in Spanish PHP (Partial Hospitalization Program)Psychiatry Services, Detox Resdidential rehab program weekly individual therapy,2-4 week of programming, Medicaid Assisted treatment; private insurance or cash; in patient; tx; mental health, dd tx"
Penrose Hospital,719-776-5000,,,
People Ready,719-632-1883,peopleready.com,2216 E Pikes Peak Ave 80909,"Includes: professional, healthcare, admin, manufacturing, engineering, management, IT, accounting, warehouse, sales, labor, construction, and hospitality"
Pikes Peak Post Acute,(719) 636-1676,pikespeakpa.com,2719 N Union Blvd 80909,"Long-term and post care (surgery/accident/illness/etc) for rehabilitation; provides speech therapists, physical and occupational therapy"
"Place, The (Youth Shelter)",719-630-3223 719-205-7129,theplacecos.org              https://coloradosprings.gov/fire-department/page/community-and-public-health-cares,"423 East Cucharras St, Colorado Springs, CO, 80903","Youth Shelter, offers rapid re-housing services, Street Outreach HUD"
Planned Parenthood,719-475-7162,https://www.plannedparenthood.org/planned-parenthood-rocky-mountains,3480 Centennial Blvd. 80907,"women's health care, men's health care, general health care, birth control, pregnancy (testing and services), HIV and STD testing, might offer financial assistance for Urinalysis"
Prism Community Collective,,https://cosprismcollective.org/,"711 S Tejon St, Colorado Springs, CO 80903","LGBTQIAKPN Community Center, resources: mental and physical health database; peer support; resources and resource navigation"
Project Angel Heart,719-323-0084,http://www.projectangelheart.org/,1625 W Uintah St #1 80904,Non-profit that provides medically tailored meals to the homes of individuals suffering from major medical conditions.
Public Utilities Commission Bills Program,303-869-0380,https://puc.colorado.gov/utilitybillhelp?utm_medium=email&utm_source=govdelivery,dora_utility_bill_help@state.co.us,"Excel energy/black hills energy/atmos energy/CO natural gas customer who are receiving any kind of benefits may qualify for: pilot Utility Bill Help program (UBH), a utility energy assistance program for income qualified consumers. The UBH program helps Coloradans access resources to manage winter heating expenses."
Pueblo Works,719-922-1627,commwrks.org/pueblo-works,"525 N Santa Fe Ave, Pueblo, 81003","complete their job seeker workshop are matched with an employment coach who provides individualized job search assistance to include resume preparation, e-mail setup if needed, interview coaching, job leads, and community referrals for housing, transportation, healthcare, counseling, childcare, food and other support services. In addition, they provide life skills assistance to help address other issues related to success--financial management, time management, conflict resolution, anger management, parenting, reconciliation, and interpersonal communication skills. Call or email through the website link to get started. PuebloWorks is also able to provide free Lifeline phones."
Purple Mountain Recovery Inc,719-445-0621,https://www.purplemountainrecovery.org/?utm_source=google&utm_medium=wix_google_business_profile&utm_campaign=17110383456569061474,"3225 Austin Bluffs Pkwy # 100, Colorado Springs, CO 80918",Mental Health & DUI services     DO NOT RECOMMEND
Q Link Wireless,855-754-6543,https://qlinkwireless.com/?srsltid=AfmBOop0ls0wMJ0UZiGxtVAIs7aAAym5a457CiTIhHISAm7FGMuC-oBI,,Government phone medicaid phone
QMAP State Approved Instructors,,https://docs.google.com/document/d/1LdZr12VPRO833LgA7AYVF8LEAn_PsKUBlfiY-xCn2Wo/pub,,List of state approved QMAP teachers for medication/medical work
Rachel Schiller,421,Family assistance program that connects healthy families with resources to help them flourish; juvenile Detention screening; Detention services for juveniles; Individualized Planning Session; Minority Family Advocacy; HiFi Wraparound; Family Support Partners,,
Raleigh House,720-891-4657 ,https://www.theraleighhouse.com/,"4401 S Quebec St, Denver CO 80237","Sober Living in Denver, Equine therapy, art therapy, indoor rock-climbing wall, horticulture and gardening, meditative yoga, 1-mile walk/run path around ranch"
Re-entry coordinator for Boulder's DA Office,303-441-1708,,"1777 6th St, Boulder, CO 80302","If you have a case with the Boulder DA's office, Deb Smith will help you navigate resources. This is an innovative program for a district attorney's office to provide, so just because it's inside a DA's office, don't be afraid to reach out to get help. Deb can help you navigate resources like housing, treatment, and more. She can also help you navigate the system. Call the number below or email Deb at dsmith@bouldercounty.org to set up an appointment."
Recovery Unlimited,(719) 358-7338,https://recoveryunlimited.biz/,"140 S Parkside Dr, Colorado Springs, CO 80910",Treatment Facility
Recovery Village at Palmer Lake,719-955-1800,palmerlakerecovery.com,"443 S Highway 105, Palmer Lake, CO 80133","Detox, Sub tx, detox, co-occurring, serious mental health illness/serious emotional disturbance in children; takes tricare, private insur, cash"
Residents Primary Care Physicians,719-653-7776,fountainvalleyhealthcare.com,1259 Lake Plaza Dr. Ste 270,Residents Primary Care Physician
Response,970-925-7233,https://responsehelps.org/,"Aspen, CO","24/7 crisis line, emergency shelter, court accompaniment, advocacy, sexual harassment assistance, medical accompaniment, immigration assistance, & education"
Restoring Lives Project,719-433-1407,,1802 Chapel Hills Dr Ste A 80920,"""Substance Abuse Treatment Trauma Adolescent Services"""
Rise Above,,https://www.riseaboveco.org/,,"Stubstance misuse prevention organization that empowers youth to make healthy connections, decisions and change. Educational resources, community and friends"
Rise Up School,719-447-9333,rup.org,"5045 List Dr, 80919; 2121 E LaSalle St, Ste 100, 80909","Individuals with Developmental disability host home providers, child family caregivers (CNA???), Children's residential program for ages 5-18 who need help; school K-12; Adult Day program; adult residential program; adult family caregiver (CNA???); adult supported employment"
Robert Half,719-960-0384,roberthalf.com,5575 Tech Center Dr Suite 110 80919,"Includes: professional, healthcare, admin, manufacturing, engineering, management, IT, accounting, warehouse, sales, labor, construction, and hospitality"
Rock Your Family,719-356-5619,,"1465 Kelly Johnson Blvd, 80920",Addiction Treatment Trauma & PTSD Adolescent Treatment
Rocky Mountain Behavioral Health,,https://rmbh.org/ ,,Mental Health Resource
Rocky Mountain Health Care Services,,,,Helps elderly and those with physical health issues to gain independence
Rocky Mountain PACE Program of All-inclusive Care for the Elderly,855-207-0702  719-314-2327,https://rmpace.org/,"8595 Explorer Dr C/S 80920   2502 E Pikes Peak Ave Ste #100 C/S, CO 80909","Coordinated and all-inclusive health care for the elderly: Social, adult day/health center, recreational activities, educational classes; Support: transportation, CM to coordinate services, home health care, personal care and laundry services, respite care; Wellness: nutritious meals and snacks, homemaker services, recreation therapy, counseling, home health care, medication, physical tx; Medical: physical and occupational therapy, emergency, hospital and nursing home care when needed, all necessary Rx with no co-pay, medical specialists, med clinic with Dr and nurses, skilled home health care"
Rocky Mountain Sober Living,719-357-6529,https://www.rockymountainsoberliving.com/,"In house contact: Bishel, Frederick; apply online; immediate intake","Sober living for male and female Men's intake: 719-357-6529; women's intake: 719-651-1233 $100 intake, $700/month; 6 HOUSES LOCAL, SAID TO BE GOOD"
Ronald McDonald House,719-471-1814,https://rmhcsoutherncolorado.org/,,Helps house parents/families of children in the hospital
Rose Andom Center,720-337-4400,https://roseandomcenter.org/,"Denver, CO","Advocacy, children’s services, civil & criminal legal, medical, self-sufficiency, & counseling"
RSA Inc.,303-232-5749,https://rsacolorado.com/   info@rsacolorado.com,"1410 Vance St, Ste 107, Lakewood, CO 80214",Dedicated to the treatment and prevention of sexually abusive behavior
Rural Development of Health,,https://www.rd.usda.gov/,,Rural resources from the department of agriculture
SAMHSA,,,,"Searchable directory of drug and alcohol treatment programs shows the location of facilities aruond the country that treat alcoholism, alcohol abuse and drug abuse problems"
Sandstone Care,866-283-9148,,2102 University Park Blvd 80918,"drug /alcohol tx. Ages 13+: Medically Managed Inpatient Detox, Residential Treatment, Day Treatment (PHP), Intensive Outpatient (IOP), and General Outpatient (OP) programming. Takes private, tricare, cash."
Savio House,(303) 225-4100,saviohouse.org,"525 E Uintah St, C/S CO 80903",Residential program; Providing in-home therapeutic treatment to children and their families is at the core of what we do; 
Saylor Academy,,https://www.saylor.org/,,"Learn new skills or earn credit towards a degree - at your own pace, with no deadlines - using free courses from Saylor Academy. Arts & humanities, business administration, computer science, English as a second language, professional development, science and math, social science. All give you knowledge or new information on each of these subjects, some can be taken for college credit!!!  Also offers: Bitcoin economics, spreadsheet mastery, monetary history"
Senior Mobile Dental,719-310-3315,https://communitydentalhealth.org/,,Dental care for seniors brought to their homes
Sense of Security,303-669-3113,http://senseofsecurity.org/,"1385 S Colorado Blvd, Ste A-714, Denver",$500 a month for up to 6 months for breast cancer patients in need while they are in active treatment
Servicios de la Raza,303-458-5851,http://www.serviciosdelaraza.org/,"Denver, Pueblo","Re-entry services, HIV & STI, essential services, youth leadership, victim services, employment and financial coaching, behavioral health, healthcare access, star community services for Latinx residents of Colorado"
Servicios De La Raza,"Pueblo: 719-359-4240, Denver: 720-410-7108, Crisis Line: 303-953-5930",https://serviciosdelaraza.org/,"Pueblo & Denver, CO","24/7 crisis line, re-entry services, STD/STI testing services, food pantry, clothing bank, case management, employment & financial coaching, behavioral health, & healthcare access"
"SET Family Medical Clinics (Service, Empowerment, Transformation)",303-458-5851,https://www.mountain.commonspirit.org/location/set-family-medical-clinics,"2864 S Circle Dr Ste 450, C/S, CO 80906","Adult physicals, behavioral health, daycare, school and sports physicals, dental hygiene, behavioral health. Bridging health care gaps for under served"
SET Homeless Clinic,719-776-8850,https://www.findhelp.org/centura-health--colorado-springs-co--set-homeless-clinic/5868439713480704?postal=80901,14 W Bijou 80903,"Homeless medical care, very low income. Teeth, cuts, infected fingers, asthma, over the counter pain medication, and antacids, medical care, hygiene items, socks, health education"
Sex Offender Solutions and Education Network,800-773-4319,https://sosen.org/,"2211 CR 400 Tobias, NE 68453","SOSEN Educate the public, the news media, law enforcement and legislators with the true facts about child sexual abuse   DEFUNCT???"
Signal Grant,888-607-4462         303-639-9320,signalbhn.org/,findcare@signalbhn.org,Grant for SUD; helps find SUD care providers and services as well as for behavioral health; colorado crisis services; children and youth mental health tx
Signing up for SSI/SSDI,800-772-1213,ssa.gov You can start an application online if you're tech savvy.,,"Look up names and addresses of doctors/hospitals/etc that they've been treated by since their last job or when the disability started, medicines they're on. SSI will back date (NOT back pay) to the first date of illness/disability/etc that proof of disability goes. Must be able to show that they worked 5/10 years prior to the disability/etc took effect."
Silver Key Senior Services,719-884-2300,https://www.silverkey.org/,"1625 S Murray Blvd, Colorado Springs, CO, 80916","Senior Resources, resource database, housing, transport, food, appointment, rent assistance, eviction help, moving assistance, medical, co-pay, no back pay, hearing aid assistance, emergency prescription, minor home repairs; Home assistance: 719-884-2300"
Sleep Charge,877-615-7257,https://app.sleepcharge.com/en/ld/epcmed,,"Comprehensive sleep care management program (diagnosis, personalized treatment pathways)"
