Dual Diagnosis rehabs,Aspen Ridge Recovery Lakewood,"Choice House, Boulder CO; Continuum Recovery Center, Denver","Footprints to Recovery, Centennial, CO","Crossroads in Pueblo, Mountain Spring Recovery, Monument, CO; Peaks Recovery Centers, C/S, CO; Raleigh House, Denver; Red Rock Recovery Center, Lakewood; The Rose House, Louisville CO; Sandstone Care, C/S, CO; Women's Recovery, Denver; Zennia Healing, Denver and Broomfield; Center for Recovery, Denver; Denver Springs, Englewood; Revive Health, Denver; HEART Counseling Center; Turning Point, Fort Collins; Peaks Recovery Centers, C/S; Rites of Passage, Crawford; Northpoint Colorado, Loveland; Acqua Recovery, Fort Collins"
Dungarvin Colorado,303-423-7660,dungarvin.com,"4704 Harlan St STE 150, Denver, CO 80212","A little about us: Dungarvin is a national organization of privately owned companies that are dedicated to providing high quality, community-based supports to people with varying support needs. Dungarvin provides a variety of individually tailored services and supports under the Medicaid Home and Community Based Waiver. Other services provided include day services, supported employment, case management, supported foster care, children’s services, respite care, host homes and supports for persons with traumatic brain injury and mental health needs in several states.  Our quality services are flexible and responsive to individual needs and choices, while maintaining the fiscal integrity that ensures the long-term stability and security every person expects and deserves."
Early Connections Learning Centers,719-632-1754,earlyconnections.org,"104 E Rio Grande St, C/S, CO 80903","Children aged 6-16 years old: offering nationally accredited programs featuring a literacy-focused curriculum, family support activities, nutritious meals and snacks, physical and behavioral health support, and a team of highly qualified professionals."
El Paso County Detox Facility,719-390-2046 719-390-2047 24/7 Ph Number 855-705-8275,NPI 1922434182   https://americanrehabs.com/treatment-centers/el-paso-county-community-detox-facility/,2723 E Las Vegas St 80906,Available 24 hours/day
El Paso County Health Department,719-578-3199,,,If a location is beyond unsafe in their messiness
El Paso County Public Health,719-578-3199,https://www.elpasocountyhealth.org/,1675 W Garden of the Gods 80907,MIGHT offer some limited health services for people of EPC
Elwood Staffing,719-578-5478,elwoodstaffing.com,3366 Templeton Gap Rd 80907,"Includes: professional, healthcare, admin, manufacturing, engineering, management, IT, accounting, warehouse, sales, labor, construction, and hospitality"
Embrave/CAE,719-633-1469,https://cdoc.colorado.gov/parole-and-re-entry-services/general-information/parole-offices,888 Garden of the Gods Rd,"Those that are on parole will need this info  If you successfully complete the tx at either place, parole can pay for first month rent and downpayment on an apartment"
Emergency Medicaid,800-221-3943,https://www.healthfirstcolorado.com/emergency-medicaid/,,"This is exactly as it says, it’s emergency Medicaid. That means that it’ll take awhile to get ahold of, no joke, may take a few hours."
Emergency Rental Assistance Program,844-926-6632,https://states.aarp.org/colorado/denver-emergency-rental-assistance-program,Online Application: https://nam12.safelinks.protection.outlook.com/?url=https%3A%2F%2Fcdola.colorado.gov%2Frental-mortgage-assistance&data=04%7C01%7CASnyder%40aarp.org%7C1f4247d777e04a873cce08d972276ddc%7Ca395e38b4b754e4493499a37de460a33%7C0%7C0%7C637666335929169365%7CUnknown%7CTWFpbGZsb3d8eyJWIjoiMC4wLjAwMDAiLCJQIjoiV2luMzIiLCJBTiI6Ik1haWwiLCJXVCI6Mn0%3D%7C1000&sdata=u5ECHKEpaHqKRuAtaEziDtptxwyDGyLExqfF3zAce%2Bc%3D&reserved=0,Colorado ERAP
Empowering students through accessible tech with an ipad pro,,https://www.donorschoose.org/project/empowering-students-through-accessible-t/8906677/?utm_source=dc&utm_medium=nextdoor&utm_campaign=project&utm_term=teacher_9236481&rf=nextdoor-dc-2024-11-project-teacher_9236481&challengeid=22211700,,"Offers an Ipad pro to underprivileged kids, accepting donations"
Entouch Wireless,866-488-8719,http://www.entouchwireless.com/,,Government phone medicaid phone
Envida Cares,719-633-4677,https://envidacares.org/,infomoves@envidacares.org,Medicare patients free medical rides
EPC Medicaid Eligibility Line,Sign-up: 719-636-0000,State: 800-359-1991,,"Will help you sort out any issues with your medicaid application, DHS based, 0000 recommended by Jarrell; for application and recertification for medicaid"
EVANS Tricare,719-526-2273,evans.tricare.mil,"7700 Arlington Boulevard, Ste 5101, Falls Church, VA 22042-5101",Evans Army Community Hospital for veterans and military; patient advocate for medical patients 719-526-7225
Everyday Eats,303-866-5700,https://cdhs.colorado.gov/CSFP,"1575 Sherman St, Denver, CO 80203","support program for qualifying Coloradans age 60+ to help keep healthy food staples in their kitchens. Known nationally as the Commodity Supplemental Food Program, Everyday Eats is quick, it's easy, and it's healthy. Participants can pick up a monthly package of cereal, canned goods and dairy with plenty of low-sodium, diabetic-friendly options to make nutritious, complete meals. Website for income limits"
Express Employment Professionals (North),719-266-9980,expresspros.com,1234 E Woodmen Ste 110 80920,"Includes: professional, healthcare, admin, manufacturing, engineering, management, IT, accounting, warehouse, sales, labor, construction, and hospitality"
Express Employment Professionals (South),719-390-1300,expresspros.com,2360 S Academy Blvd 80916,"Includes: professional, healthcare, admin, manufacturing, engineering, management, IT, accounting, warehouse, sales, labor, construction, and hospitality"
Express Scripts,855-738-1153,express-scripts.com,Accredo SpecialtyRx: 800-803-2523,Prescription Plan Contact Information
Familly Resource Network CO,719-227-7477,https://familyresourcenetworkco.com/clinical-services/supervised-parenting-time,"5360 N Academy Blvd Ste 130, Colorado Springs, CO 80918","Resource Database, family visitation, CFI/Meditation, therapy (individual, family, couples), home studies, Contractual adoptive support services, to include home studies, pre and post placement services, and trainings, family preservation, supervised parenting time, classes such as first aid cpr, parenting classes, parent child interactions, life skills"
Family Support Center FSC,(719) 644-7511,https://fscautism.com/,6160 Tutt Blvd #120,"treatment of children and families impacted by Autism Spectrum Disorders. We understand that autism impacts the entire family and have designed a treatment program that offers support, education, treatment and a place of refuge for families."
Family Voices,303-877-1747,https://www.familyvoicesco.org/,info@familyvoicesco.org,"Resource Database for family needs; resource navigation; education and training (medicaid 101, HCBS-home and community based service waivers, insurance appeals, medical home model of care, family engagement, funding, navigating systems of care); advocacy and policy; "
Federal Department of health and human services job,,https://www.hhs.gov/careers/how-apply/how-apply-hhs-person-disabilities,,Will hire individuals with disabilities and with accomodations
Financial Wellness Sessions,,ent.com/events,Free virtual financial wellness sessions,Free virtual financial wellness sessions
Find Treatment,,findtreatment.gov,,Helps to find medical/mental health/drug tx needed
First Visitor,719-632-5700,https://www.peakvista.org/services/first-visitor,,"Classes for parents to prevent sudden infant death syndrome (SIDS), abusive head trauma (AHT), or shaken baby syndrome (SBS); home mental health visits for yough children, program A: 0-12 months; probram B: 12-24 months; program C: 24-36 months; program D: 3-5 years. "
Fitness to Drive,719-231-6657 F: 719-931-5559,fitnesstodrive.org,Colorado Springs,"Helps rehabilitate those that want to drive but are suffering from rehabilitation, chronic health conditions, MCI, low vision, neuropathy, arthritis, new drivers"
"For Applicants of SSI, temp $",303-333-3482,http://coloradopeak.secure.force.com/,Details: https://www.senioranswers.org/financial-resources/and-ab/,"$200 a month for those applying for SSI/etc, 18-60 yo, click the check the 'adult financial' assistance box on the standard medicaid application"
Forge Evolution,719-475-7815 fax: 719-385-6202,https://forgeevolution.org/,"224 E Kiowa St Rm 230, Colorado Springs, CO 80903",Colorado Springs Teen Court; offers expungement of records for teens that finish their program. Resources that help prevent recidivism. Services covered by medicaid and chp and sliding scale; counseling in-person and telehealth; case management to teen and families.
Forget-Me-Not,719-922-7906,forgetmenotcc.com     info@forgetmenotcc.com,"1425 N Union Blvd C/S, CO 80909","for children with mental or physical disabilities: part/full-day therapy sessions that helps to increase verbal, non-verbal comm; improve social interactions and relationships; develop self-help skills such as potty training, eating, and dressing; reduce harmful behaviors such as aggression, self-injury, elopement, tantrums; improve cognition, learning and play skills"
Fountain Valley Medical Center,1-719-653-7776,http://www.fountainvalleyhealthcare.com/,"1259 Lake Plaza Dr #270, Colorado Springs, CO 80906","Mental Health Assisstance, possibly can get in on short notice."
Friends of Man,303-798-2342,friendsofman.org,,"Car Repairs, hearing aids, glasses, daycare, wheel chair adaptation (joystick), corrective helmets, wheelchair repair, van accessibility, assistive tech, clothing, nursing home holiday gifts, daycare supplement, dental, food, prosthesis, glasses, wheelchair ramp, stair lift, medical equipment, custom crutches, mobility equipment, therapy, therapy camp, vehicle hand controls"
Front Range Clinic,(866) 628-7828,https://porchlighthealth.com/suboxone-clinics/colorado-springs-colorado/,1861 Austin Bluffs Pkwy,Health Services
Front Range Staffing,719-323-6632,frontrangestaffing.com,1257 Lake Plaza Dr Suite 203 80906,"Includes: professional, healthcare, admin, manufacturing, engineering, management, IT, accounting, warehouse, sales, labor, construction, and hospitality"
Gateway to Success,719-374-1650,,,Substance Abuse Treatment and MA/OT Psychiatric services/DUI education/Domestic violence treatment
Golden Lotus Foundation Asian Heritage Center,719-540-5338,https://www.goldenlotusfoundation.org/?utm_source=google&utm_medium=organic&utm_campaign=gbp,"1819 W Cheyenne Rd, C/S, CO 80906","NFP for cultural activities, publications"
Goodwill Resources,,https://goodwillcolorado.org/services/,,"Resource database of what's offered by goodwill. Help with farmers/ranchers, developmental, aging challenges, independence in agriculture trade and commerce; job training and support, LEAP (low-income energy assistance program); information technology training A+ cert, network + cert and security + cert for comptia; career development services, youth education/career development, mentoring, soft skills, work opportunities for those with disabilities (custodial), child support/improved payments and child success (impacs 303-412-3150), educational and social integration for refugee youth (CLIMB 720-392-8242), work skills and family stabilization (colorado works/tanf), soft and practical skills training (self-esteem, self-motivation, personal responsibility and reliability, cultural diversity and acceptance 720-738-0001), day program for individuals with significant disabilities, day program for individuals with developmental disabilities (POSSIBILITIES), day program for seniors (VOYAGES), in0home care: your life your way, Senior move managers (things forgotten not gone, moving service to help seniors moving into aging community/etc); in-home support services, financial support to caregivers for loved ones with disabilities on medicaid (free medical benefits); residential services (individuals with developmental and age-related challenges to remain independent); transitional students support (one-on-one job skills development for preparation for graduation); commercial contract services for businesses. Donation pick ups"
Grand View Hospital,,,,
Grey Team,561-203-3815,https://www.greyteam.org/,"1181 S Rogers Cir #28 Boca Raton, FL 33487","Grey Team’s comprehensive health and wellness programs directly heal all the invisible wounds of war including, but not limited to: traumatic brain injuries, post-traumatic stress disorder, chronic pain, self-medication, and isolation."
Griffith Center,303-237-6865,https://griffithcenters.org/   info@griffithcenters.org,10190 Bannock St STE 120 80260,"Griffith Centers is a non-profit organization offering a full spectrum of mental and behavioral health services to care for populations who have experienced trauma and hardships to build resiliency, hope, and healing for those we serve. Advocate Kids Success/ASK school and truancy; specialized instruction for students in grades 3-12; outpatient mental and behavioral health services; adults with disabilities services; SUD substance use disorder services; supportive services"
Guide Star,,https://www.guidestar.org/?utm_term=guide%20star&utm_campaign=GuideStar+Brand+Control&utm_source=google&utm_medium=cpc&hsa_kw=guide%20star&hsa_net=adwords&hsa_ad=671719330545&hsa_tgt=kwd-298360336&hsa_acc=7561599582&hsa_cam=15858689038&hsa_src=g&hsa_ver=3&hsa_mt=b&hsa_grp=131578037265&gad_source=1&gclid=CjwKCAiA3Na5BhAZEiwAzrfagPg5FVZg9k3E5CCDfu4Y2pIX9_FATjm3HCrTVsoP5leFJcxLvxt1IRoCBOMQAvD_BwE,,Resource Guide for not-for-profits
Harley's Hope,719-495-6083,harleys-hopefoundation.org,info@harleys-hopefoundation.org PO BOX 88146 C/S 80908,"Resources for pets and keeping their homes intact, financial, food, health care for pet"
Healing Warriors Program,970-776-8387,healingwarriorsprogram.org,"1044 W Drake Rd, Ste 202, Fort Collins, CO 80526",organization serving the veteran community and their families by providing care therapies that integrate with a service member’s standard medical care in order to achieve the individual’s wellness goals and restore quality of life.
Health Care for Homeless Veterans HCHV,,,,"Outreach, exams, treatment, case management at over 135 sites nationwide"
Health Care Policy & Financing,,https://hcpf.colorado.gov/program-list,,Resource database for complementary programs for healthcare services such as medicare/medicaid.
Health First Colorado,800-221-3943,https://www.healthfirstcolorado.com/,,Helps with Medicaid
Health Solutions,719-545-2746,health.solutions,41 Montebello Rd Pueblo 81001,"Multiple locations in Trinidad, Walsenburg, Pueblo (x2); residential program, family medicine, crestone recovery; childcare services"
Healthcare Finder,,ihs.gov/findhealthcare/,,Finds Native American approved healthcare/accepts NA healthcare
Healthcare for the Homeless Directory,,https://nhchc.org/grantee-directory/,,resource database for homeless healthcare
Healthcare Policy and Financing HCPF,,https://apps.colorado.gov/apps/maps/hcpf.map,,Please call to schedule an appointment for help with completing a medical assistance application. All locations searchable in this tool may verify required documentation for medical assistance programs.
Hear USA Colorado Springs North,,https://www.hearusa.com/hearing-centers/details/us/80918/colorado-springs/hearusa-colorado-springs-north/16008/?utm_source=google&utm_medium=organic&utm_campaign=businessprofile&utm_content=hearusa-colorado-springs-north-website-40012,6475 Wall St Ste 203 Colorado Springs CO 80918,Possible financial assistance for hearing aids
Help Our Wounded (HOW) Foundation,561-450-6213,howfoundationsf.org,"1030 Wallace Dr, Ste C FL 33444",HOW Foundation supports and promotes the use of hyperbaric oxygen therapy to treat traumatic brain injuries and post-traumatic stress.
Herren Project,401-243-8590,herrenproject.org,recovery@herrenproject.org,"All resources and tx possible for recovery needs. Offers scholarships, (for housing and unknown); funded by state"
High Plains Helping Hands/Fresh Start Center,719-495-3123,https://www.freshstartcenter.com/   Facebook: Fresh Start Center,"7375 Adventure Way, C/S, CO 80923?????????","We fight hunger, poverty, joblessness through sustainable agriculture, food distribution, employment programs, nursing support and case management, health services, education for farming and gardening, healthy cooking classes, finance coaching"
Holistic Doctor,719-784-9735,http://wellnesstherapycenter.com/,"119 S Pikes Peak Ave, Florence, CO 81226",Holistic Doctor
Homeless Veterans,877-424-3838,va.gov/HOMELESS/docs/,,"Programs that offer permanent supportive housing for vets; free health care for homeless vets (HCHV) that offers outreach, exams, treatment and case management to help vets rebuild their lives; supportive services for veteran families (SSVF); VA's homeless veterans community employment services (HVCES), job training, career development and employers ready to hire; women veterans program manager "
Homeless Veterans Community Employment Services HVCES,,https://www.va.gov/homeless/hvces.asp,,"improve employment outcomes for Veterans who have experienced homelessness. HVCES has deployed more than 150 Vocational Development Specialists who serve as Community Employment Coordinators (CECs), at most VA Medical Centers across the country."
Housing Hub Colorado,,https://housinghubcolorado.com/?utm_medium=email&utm_source=govdelivery,,A centralized resource for affordable rental housing utilizing federal housing tax credits and state and local gap funding
Humane Colorado,303-751-5772,humanecolorado.org,info@humanecolorado.org,"When the demand for veterinary services to underserved pets increased dramatically, the organization was ready to help. In 2018, Dumb Friends League Veterinary Hospital at Yuma expanded its services to help prevent and alleviate suffering in pets whose caretakers would otherwise be unable to provide this care."
Humane Society of the Pikes Peak Region,719-473-1741,hsppr.org,610 Abbot Ln 80905,Animal assistance/hospital
Independence Center,719-471-8181,theindependencecenter.org,"729 S Tejon St, 80903","Handicapable assistance; homeless assistance, civil rights for people with disabilities, Disability advocates, home health, CAN program, family payer program, Home Modification, reduced price bus passes, id voucher, non-sober housing voucher: Erika"
Inner City Health,303-296-1767,https://www.innercityhealth.org/,"3800 York St, Denver, CO 80205",Inner City Health provides high quality healthcare to underserved individuals in the Denver Metro area.
"Integrating Supports, Co",719-3133-0626,https://integratingsupports.com/,,Supported employment for those with mental health/disabilities towards independence and stability
Interfaith Hospitality Network,719-329-1244,https://www.familypromisecos.org/interfaith-hospitality-network,"420 N Nevada Ave, Colorado Springs, CO, 80901","Shelter/Housing, parenting skills, case management community support, referral services"
"Intervention, inc.",303-450-6000,int-cjs.org/c3,https://www.int-cjs.org/locations    ,"addiction recovery, mental health, photo id/dL, medicaid, medical/dental, housing resources, sober living, peer support specialists, job search assistance, food and clothing, transportation, GED, trade/life skills, financial management, veterans assistance, legal resources"
Joint Initiatives for Youth & Families,719-630-0927,jointinitiatives.org,"123 E. Las Animas St., C/S, CO, 80903","military family resources, child health and behavior supports, finding quality child care, opening a child care business, early childhood workforce, resource database"
Justice Center C/S,719-473-6212,https://www.justicecentercos.org/apply    media@justicecentercos.org ,,Lawyer Referral: No court date within 6 weeks; priority persons: survivors of family violence; honorably discharged vets and dependants; active duty members; persons with disabilities; senior citizens; immigrants and refugees; persons with landlord/tenant issues
Kador Transport (K.A. Dorman Ent.),719-470-0227,kadorent@gmail.com,,Out of state medical transport
Kelly Services,719-528-5811,kellyservices.com,6760 Corporate Dr Suite 310 80918,"Includes: professional, healthcare, admin, manufacturing, engineering, management, IT, accounting, warehouse, sales, labor, construction, and hospitality"
Kid Power Colorado,719-520-1311,https://kidpowercs.org/,"2335 Robinson St, Colorado Springs 80904","Kidpower’s mission is to teach young people personal safety and confidence-building skills to reduce their risk of abduction, assault and emotional, physical and sexual abuse. Our programs are known worldwide for being positive, practical, safe and age-appropriate."
Labor Finders,719-634-1699,laborfinders.com,2828 N Nevada Ave 80907,"Includes: professional, healthcare, admin, manufacturing, engineering, management, IT, accounting, warehouse, sales, labor, construction, and hospitality"
LaborMax Staffing,719-358-6138,labormax.net,2810 E Pikes Peak Ave 80909,"Includes: professional, healthcare, admin, manufacturing, engineering, management, IT, accounting, warehouse, sales, labor, construction, and hospitality"
Lamar Colorado,719-336-0650,https://atreatmentcenters.com/lamar-co/   irtreferrals@atreatmentcenters.com ,"800 E. Maple St. Lamar, CO 81052","IRT, dual diagnosis"
Launchpad Apartments,719-427-2609,https://www.thelaunchpadapts.com/,"846 N 19th St, C/S, CO","Run by 'the Place' and is affordable and supportive housing for 18-24 yo to help them turn their lives around; free of charge, paid for by Colorado Division of Housing; 13% for homeless vets paid by state vouchers; Seniors earning 40-60% median income will fill other units"
Law Enforcement Assissted Diversion LEAD Program,303-877-2752,https://bha.colorado.gov/behavioral-health/LEAD     camille.ferran@state.co.us,Times they help: Low-level controlled substance-related and/or prostitution offenses and whom have been repeatedly involved with law enforcement. Continued and/or increased engagement with the criminal justice system due to behaviors and patterns associated with unmet behavioral health needs.,"Locations the program is in effect: Cities: Alamosa (covering the San Luis Valley), Denver, Longmont, Counties: Pueblo, Denver"
LGBTQIAKPN,,how-to-have-the-talk.org                       you-flourish.com,envision-you-training.org,LGBTQIAKPN mental health resource
Life Wireless,888-543-3620,https://lifewireless.com/,Georgia,Government phone medicaid phone
Lindstrom Clinic,719-327-5660,https://www.va.gov/eastern-colorado-health-care/locations/pfc-floyd-k-lindstrom-department-of-veterans-affairs-clinic/,"3141 Centennial Blvd, C/S, CO 80907",Veteran walk-in clinic; Monday and Thursday 9-3; quick issues only
Lutheran Services in America,202-499-5836,http://www.lutheranservices.org/   lsa@lutheranservices.org,100 Maryland Ave NE Washington DC 20002,"Lutheran Services in America (LSA) is one of the largest health care and human services networks in the country, representing 300 Lutheran nonprofit organizations throughout the United States and the Caribbean. LSA works to connect and empower our member organizations, which serve six million people annually, touching the lives of one in every 50 people in the U.S. every year."
Manpower,719-633-7300,us.manpower.com,1155 Kelly Johnson Blvd Ste 111 80920,"Includes: professional, healthcare, admin, manufacturing, engineering, management, IT, accounting, warehouse, sales, labor, construction, and hospitality"
Marion House,719-475-7314,http://www.ccharitiescc.org/,"14 W Bijou St, Colorado Springs, CO, 80903","A soup kitchen, medical partners, Hanifen Employment Center, education, employment skill development, computer training, "
Matthews Vu,Weber 574-7083,Woodmen 632-4455  Southeast 574-7038 Rockrimmon 522-0707,Downtown 473-6171,Accepts Medicaid
Maxim Healthcare Services,719-538-5600,maximhealthcare.com,7150 Campus Dr 80920,Homecare
Medicaid 24/7,1-800-283-3221,,,"I have had no reviews/insights into this contact. If you do use them, please tell me how it goes."
Medicaid State Sign-Up Line,800-221-3943,,,State medicaid sign-up line
Medicaid buy ins,1-800-711-6994,https://www.healthfirstcolorado.com/get-help/   https://hcpf.colorado.gov/buy-in-program-working-adults-disabilities,Sign-up: 719-636-0000,"Price based on income; Must have pre-existing conditions that would normally get you in for SSDI/SSI; DO NOT SEND PAPERWORK TO EMAIL, SEND/TAKE TO COUNTY DHS"
Medicaid Doctor Lookup,,https://www.healthfirstcolorado.com/find-doctors/,,
Medicaid Funeral Expenses,,https://ckf.cchn.org/blog/little-known-medicaid-benefits-burial-assistance-program/,https://drive.google.com/file/d/11nwNGSQSu-uwfyTLlBNJ_22GEV6N1IAH/view,"1st link is the explanation, second link is the form to fill out"
Medicaid Phone,,brenda@sunrisecounselingcs.com,,"Send the following information to the email listed to the left: First and Last Name, Last 4 of SS Number, Date of Birth, Address with your zip code and apartment number, email address"
Medicaid Portal,,Colorado Provider Portal > Home (gainwelltechnologies.com),,"I have had no reviews/insights into this contact. If you do use them, please tell me how it goes."
Medicaid Rides,866-288-3133,,,Hearing Impaired Medicaid Ride
Medicaid Transport Reimbursement,719-520-6905,,,"If drove personal vehicle to appt, call for possible reimbursement."
Medical Records,719-344-6108,F: 719-344-7817,3207 N Academy Blvd Ste 1300 80917,Peak Vista Medical Records
Medicare Bus Passes,303-444-3043   719-471-8181,https://coloradosprings.gov/mountain-metro/fares-and-tickets-hub,729 S Tejon St 80903,"In the medicare application, you can buy single use, day and multiple bus passes for REAL cheap"
